target,text,stance,word_count,sentence_count,avg_word_length,std_word_length,type_token_ratio,hapax_legomena,stopword_ratio,punctuation_density,noun_ratio,verb_ratio,adj_ratio,adv_ratio,pronoun_ratio,avg_dependency_depth,function_word_ratio,punctuation_usage,readability_score,sentence_length_variation,subordinate_clause_ratio,sentiment_polarity,sentiment_subjectivity,anger,joy,fear,sadness,disgust,surprise,certainty_adverbs_count,certainty_verbs_count,certainty_adjectives_count,doubt_adverbs_count,doubt_verbs_count,doubt_adjectives_count,hedges_score,hedge_C_count,hedge_D_count,hedge_E_count,hedge_I_count,hedge_N_count,C_ratio,D_ratio,E_ratio,I_ratio,N_ratio
school_closures,"@JoeSilverman7 When my kid started preK, we were at the docs once per month. Doc always said, hang in there, it’s better for him. Fast forward 6 years:other than well visits and vaccines, he hasn’t been sick. I’m willing to take my chances as a high risk mom...",0,65.0,4.0,3.292307692307692,2.2307161797405364,0.8769230769230769,0.8153846153846154,0.4,0.18461538461538463,0.23076923076923078,0.13846153846153847,0.07692307692307693,0.12307692307692308,0.1076923076923077,1.0,0.4918032786885246,0.09230769230769231,4.4,1.5811388300841898,0.046153846153846156,0.07914285714285714,0.6494285714285715,0.020425407215952873,0.3129141628742218,0.47515931725502014,0.022655267268419266,0.0009569041430950165,0.018632391467690468,0.0,1.0,2.0,0.0,0.0,2.0,0.0,48.0,0.0,0.0,0.0,0.0,1.0,0.0,0.0,0.0,0.0
school_closures,Schools need to open. It can be done safely. My children deserve to go to school. They WANT to go to school. @GavinNewsom,0,28.0,5.0,3.5357142857142856,2.4997448849424453,0.6785714285714286,0.5357142857142857,0.35714285714285715,0.17857142857142858,0.17857142857142858,0.2857142857142857,0.0,0.03571428571428571,0.10714285714285714,1.0,0.48148148148148145,0.14285714285714285,0.8,2.0591260281974,0.10714285714285714,0.25,0.5,0.7783485651016235,0.1088777408003807,0.02303326316177845,0.06005021184682846,0.001251965411938727,0.009538089856505394,0.0,3.0,0.0,0.0,0.0,0.0,0.0,23.0,0.0,0.0,0.0,0.0,1.0,0.0,0.0,0.0,0.0
school_closures,"Is shutting down schools going to affect teacher and learner's mental health? 

#OurFutureNeedsYou
#WellnessWednesday",0,18.0,2.0,5.666666666666667,4.618802153517006,0.9444444444444444,0.8888888888888888,0.2222222222222222,0.2222222222222222,0.3333333333333333,0.2222222222222222,0.05555555555555555,0.0,0.0,1.0,0.25,0.05555555555555555,12.3,5.0,0.05555555555555555,-0.12777777777777777,0.24444444444444446,0.04205561429262161,0.007804212160408497,0.8374878168106079,0.09403226524591446,0.0009854958625510335,0.011989389546215534,0.0,0.0,0.0,0.0,1.0,0.0,0.0,14.0,0.0,0.0,0.0,0.0,1.0,0.0,0.0,0.0,0.0
school_closures,the fact that my district isn’t closing the schools because no student has the corona virus (that we know of) when the hospitals are saying that there WILL be an outbreak is ridiculous.,0,38.0,1.0,4.026315789473684,2.4005135646276234,0.868421052631579,0.8157894736842105,0.5789473684210527,0.07894736842105263,0.3157894736842105,0.18421052631578946,0.02631578947368421,0.0,0.05263157894736842,1.0,0.5945945945945946,0.02631578947368421,12.6,0.0,0.18421052631578946,-0.3333333333333333,1.0,0.5373625159263611,0.002079133177176118,0.02271357737481594,0.009057828225195408,0.19152450561523438,0.08457793295383453,1.0,1.0,1.0,0.0,0.0,0.0,0.0,33.0,0.0,0.0,0.0,0.0,1.0,0.0,0.0,0.0,0.0
school_closures,"@imBhupendrasinh @vijayrupanibjp @CMOGuj
Your order is equivalent. How can schools teach without getting paid?",0,19.0,2.0,5.105263157894737,4.089714143171034,0.8947368421052632,0.8421052631578947,0.21052631578947367,0.2631578947368421,0.3684210526315789,0.21052631578947367,0.10526315789473684,0.0,0.05263157894736842,1.0,0.29411764705882354,0.10526315789473684,9.6,0.0,0.0,0.0,0.0,0.901780366897583,0.0035411317367106676,0.037999335676431656,0.03682737424969673,0.0006405806634575129,0.010521164163947105,0.0,0.0,0.0,0.0,0.0,0.0,0.0,14.0,0.0,0.0,0.0,0.0,1.0,0.0,0.0,0.0,0.0
school_closures,"Alcohol was banned with immediate effect because it provides no tenders for creedy comorates, school will proceed due to the fact that they have tenders in schools, ppes, feeding schemes, transportation, etc",0,37.0,1.0,4.756756756756757,2.8418247412097113,0.8648648648648649,0.8108108108108109,0.35135135135135137,0.13513513513513514,0.32432432432432434,0.16216216216216217,0.05405405405405406,0.0,0.05405405405405406,1.0,0.3783783783783784,0.0,14.6,0.0,0.08108108108108109,-0.125,0.375,0.07800637930631638,0.00621682358905673,0.13309447467327118,0.24268366396427155,0.33989936113357544,0.008107763715088367,1.0,0.0,1.0,0.0,0.0,1.0,0.0,32.0,0.0,0.0,0.0,0.0,1.0,0.0,0.0,0.0,0.0
school_closures,"You can go to grocery stores, schools should be easy!",0,12.0,1.0,3.6666666666666665,2.173067468400883,1.0,1.0,0.4166666666666667,0.16666666666666666,0.25,0.16666666666666666,0.08333333333333333,0.0,0.08333333333333333,1.0,0.5,0.08333333333333333,1.3,0.0,0.08333333333333333,0.5416666666666667,0.8333333333333334,0.030616173520684242,0.3915325105190277,0.003798188641667366,0.009798932820558548,0.005925231147557497,0.10618580877780914,0.0,0.0,0.0,1.0,0.0,0.0,0.0,10.0,0.0,0.0,0.0,0.0,1.0,0.0,0.0,0.0,0.0
school_closures,@FOX10Phoenix the boys &amp; girls clubs are OPEN for business &amp; the Governor @dougducey can't figure out how to open Schools !!!! Do you see the insanity in your story just now? #OpenArizona,0,45.0,4.0,3.6222222222222222,2.7185689772287587,0.8,0.6666666666666666,0.3111111111111111,0.28888888888888886,0.35555555555555557,0.1111111111111111,0.0,0.06666666666666667,0.044444444444444446,1.0,0.3953488372093023,0.1111111111111111,7.2,8.616843969807043,0.06666666666666667,0.0,0.5,0.20108461380004883,0.0367768220603466,0.2957751452922821,0.307498961687088,0.0005073043284937739,0.1454029381275177,0.0,0.0,1.0,0.0,0.0,0.0,0.0,33.0,0.0,0.0,0.0,0.0,1.0,0.0,0.0,0.0,0.0
school_closures,"#Covid19 killed 58 children under age 18. most are asymptomatic.  in 2017-18, the seasonal flu killed 188 children in the same age bracket. if they want to rely on data to open schools, I'm all for it. seems like a slam dunk to me.",0,52.0,4.0,3.5961538461538463,2.339128826858207,0.7884615384615384,0.6346153846153846,0.38461538461538464,0.19230769230769232,0.19230769230769232,0.15384615384615385,0.11538461538461539,0.0,0.07692307692307693,1.0,0.39285714285714285,0.09615384615384616,2.0,2.7386127875258306,0.057692307692307696,0.019999999999999997,0.225,0.08583598583936691,0.023668650537729263,0.3553759753704071,0.40061017870903015,0.0007010305416770279,0.11875005066394806,0.0,2.0,0.0,1.0,0.0,0.0,0.9670512676239014,42.0,0.0,1.0,0.0,1.0,0.9545454545454546,0.0,0.022727272727272728,0.0,0.022727272727272728
school_closures,Massachusetts governor Charlie Baker as well as Massachusetts State Democrats are trying to get Fed funding for daycare. Now if they can open daycares they surely can open schools. I believe coronavirus doesn't discriminate between toddlers n school-age children.,0,43.0,3.0,5.232558139534884,3.297900736813588,0.8372093023255814,0.6976744186046512,0.32558139534883723,0.11627906976744186,0.32558139534883723,0.18604651162790697,0.023255813953488372,0.13953488372093023,0.06976744186046512,1.0,0.37777777777777777,0.06976744186046512,8.4,3.559026084010437,0.09302325581395349,0.16666666666666666,0.6296296296296297,0.015532097779214382,0.003541640704497695,0.007288149558007717,0.004101137164980173,0.0077165402472019196,0.01419095415621996,1.0,1.0,0.0,0.0,0.0,0.0,0.9728973507881165,37.0,1.0,0.0,0.0,1.0,0.9487179487179487,0.02564102564102564,0.0,0.0,0.02564102564102564
school_closures,"It’s so great to know that all the rich Tory politicians can shield their elderly &amp; at risk loved ones while the rest of us, who can’t afford to stay at home, can just fuck off &amp; die :hugging_face: #Covid_19 #COVID_19uk #CoronavirusPandemic #coronavirus",0,59.0,1.0,3.711864406779661,3.2989512840954194,0.7627118644067796,0.576271186440678,0.3559322033898305,0.2542372881355932,0.2711864406779661,0.11864406779661017,0.06779661016949153,0.03389830508474576,0.05084745762711865,1.0,0.38596491228070173,0.0,16.5,0.0,0.11864406779661017,0.36875,0.725,0.47301873564720154,0.035705070942640305,0.47322699427604675,0.012591795064508915,0.002018208149820566,0.0020716958679258823,0.0,1.0,2.0,1.0,0.0,0.0,0.0,43.0,0.0,0.0,0.0,0.0,1.0,0.0,0.0,0.0,0.0
school_closures,"Since teachers are afraid to reopen schools for the fear of catching Covid, then maybe we should just bring the classroom to Walmart since most of them probably have no problem going in there.",0,36.0,1.0,4.416666666666667,2.1262251370288454,0.9166666666666666,0.8333333333333334,0.5,0.05555555555555555,0.19444444444444445,0.16666666666666666,0.05555555555555555,0.1388888888888889,0.05555555555555555,1.0,0.5555555555555556,0.027777777777777776,13.0,0.0,0.1388888888888889,0.16666666666666666,0.7666666666666666,0.00812770240008831,0.0041947695426642895,0.725926399230957,0.00817906018346548,0.006181355565786362,0.006682886276394129,1.0,0.0,1.0,2.0,0.0,0.0,0.968538761138916,32.0,0.0,2.0,0.0,0.0,0.9411764705882353,0.0,0.058823529411764705,0.0,0.0
school_closures,@AmitCTweets @vijayrupanibjp @myogiadityanath @DrRPNishank @mlkhattar @msisodia @NitishKumar @OfficeofSSC @OfficeofUT @swarup58 @PandaJay No Crime can be bigger than  the  crime  of  halting teaching by Private Schools.,0,37.0,1.0,5.162162162162162,4.194678182505127,0.7297297297297297,0.7027027027027027,0.1891891891891892,0.32432432432432434,0.7027027027027027,0.08108108108108109,0.05405405405405406,0.0,0.0,1.0,0.23333333333333334,0.02702702702702703,17.8,0.0,0.0,0.0,0.4375,0.16711395978927612,0.010470430366694927,0.7698513269424438,0.044147927314043045,0.0004981897072866559,0.004718944896012545,0.0,0.0,0.0,0.0,0.0,0.0,0.0,25.0,0.0,0.0,0.0,0.0,1.0,0.0,0.0,0.0,0.0
school_closures,"@ChuckCallesto Start protesting parents and everyone who wants the Economy to be stable. 
The pandemic is not as bad as initially thought.  Every child should be allowed to go to school as normal.  Face masks also make zero sense.  99.95 chance of survival and rising!",0,51.0,5.0,4.313725490196078,2.6456786525365295,0.8235294117647058,0.7254901960784313,0.3333333333333333,0.13725490196078433,0.27450980392156865,0.17647058823529413,0.0784313725490196,0.0784313725490196,0.0,1.0,0.4074074074074074,0.11764705882352941,4.4,2.756809750418044,0.0784313725490196,-0.07812499999999996,0.35416666666666663,0.9221686720848083,0.011501998640596867,0.052088771015405655,0.008929189294576645,0.0004600257962010801,0.0030234698206186295,0.0,0.0,0.0,1.0,0.0,1.0,0.0,45.0,0.0,0.0,0.0,0.0,1.0,0.0,0.0,0.0,0.0
school_closures,"@JRubinBlogger He doesn’t want to kill any kids. :woman_facepalming:
Using your misguided logic KIDS can NEVER go back to school until they ERADICATE the FLU!!
The Flu is more deadly to kids than the Coronavirus!",0,44.0,3.0,4.045454545454546,3.281868546579036,0.8409090909090909,0.7272727272727273,0.38636363636363635,0.18181818181818182,0.25,0.1590909090909091,0.06818181818181818,0.09090909090909091,0.06818181818181818,1.0,0.4772727272727273,0.09090909090909091,6.7,3.858612300930075,0.06818181818181818,0.08333333333333333,0.3,0.11062447726726532,0.011153423227369785,0.6311165690422058,0.19554781913757324,0.0013856632867828012,0.028094323351979256,0.0,1.0,0.0,0.0,0.0,0.0,0.8089233636856079,34.0,0.0,0.0,0.0,1.0,0.9714285714285714,0.0,0.0,0.0,0.02857142857142857
school_closures,"@Gagan2627 Let's be careful what we wish for. If govt schools were working fine, India would not have needed private schools. School owners pay teachers, rentals &amp; other expenses from the fee that parents pay. With FRC, anyways, there is control on fee. What more is needed?",0,60.0,5.0,3.8666666666666667,2.2469732728470286,0.8166666666666667,0.7,0.31666666666666665,0.21666666666666667,0.2833333333333333,0.18333333333333332,0.08333333333333333,0.05,0.016666666666666666,1.0,0.3559322033898305,0.08333333333333333,3.4,3.6660605559646724,0.08333333333333333,0.13833333333333334,0.55,0.02415264956653118,0.029322782531380653,0.03615133836865425,0.11207927763462067,0.001017648377455771,0.18241627514362335,1.0,1.0,1.0,1.0,0.0,0.0,0.9649956822395325,45.0,0.0,0.0,0.0,2.0,0.9574468085106383,0.0,0.0,0.0,0.0425531914893617
school_closures,@nycjim @PressSec Every European country has their schools open No Super Spreaders get a grip open up the schools . . As far as the PresSec people make mistakes  everyone knows it was a slip of the tongue.,0,41.0,3.0,4.073170731707317,2.39298001686069,0.8048780487804879,0.6585365853658537,0.34146341463414637,0.12195121951219512,0.36585365853658536,0.14634146341463414,0.04878048780487805,0.04878048780487805,0.04878048780487805,1.0,0.45,0.07317073170731707,6.8,8.339997335464535,0.14634146341463414,-0.01333333333333333,0.5333333333333333,0.8191627860069275,0.007058325223624706,0.12872321903705597,0.02916042134165764,0.0003733933554030955,0.006882317829877138,1.0,0.0,0.0,0.0,0.0,0.0,0.0,38.0,0.0,0.0,0.0,0.0,1.0,0.0,0.0,0.0,0.0
school_closures,"I hope all of those who are so keen to have the schools stay closed are also ok with the staff not having jobs...adios teacher aides , bus drivers etc.",0,33.0,1.0,3.696969696969697,1.64196571929019,0.9393939393939394,0.8787878787878788,0.45454545454545453,0.15151515151515152,0.18181818181818182,0.2727272727272727,0.09090909090909091,0.09090909090909091,0.030303030303030304,1.0,0.45454545454545453,0.12121212121212122,4.2,0.0,0.09090909090909091,0.2,0.3,0.02951500192284584,0.10844723135232925,0.010653313249349594,0.10862734168767929,0.007725065108388662,0.04942357540130615,0.0,1.0,2.0,1.0,0.0,0.0,0.0,30.0,0.0,0.0,0.0,0.0,1.0,0.0,0.0,0.0,0.0
school_closures,@CalmdeezNutz Only idiots close schools! The science days children don't get the #KungFlu!,0,18.0,2.0,4.333333333333333,2.9249881291307074,0.9444444444444444,0.8888888888888888,0.2222222222222222,0.2777777777777778,0.3888888888888889,0.16666666666666666,0.05555555555555555,0.1111111111111111,0.0,1.0,0.35294117647058826,0.1111111111111111,2.3,1.5,0.05555555555555555,-0.5,0.9,0.7291075587272644,0.006177754607051611,0.07969176769256592,0.1520053595304489,0.0007958350470289588,0.021959474310278893,0.0,0.0,0.0,0.0,0.0,0.0,0.0,13.0,0.0,0.0,0.0,0.0,1.0,0.0,0.0,0.0,0.0
school_closures,"""...schools extremely important, they are essential and they must re-open"" - @PressSec",0,17.0,1.0,4.529411764705882,2.8925390242692344,0.9411764705882353,0.8823529411764706,0.23529411764705882,0.5294117647058824,0.17647058823529413,0.11764705882352941,0.11764705882352941,0.058823529411764705,0.11764705882352941,1.0,0.3333333333333333,0.17647058823529413,7.6,0.0,0.11764705882352941,0.2,0.65,0.07787957787513733,0.03994369879364967,0.49044984579086304,0.07986544072628021,0.0016735050594434142,0.07657435536384583,1.0,0.0,0.0,0.0,0.0,0.0,0.0,12.0,0.0,0.0,0.0,0.0,1.0,0.0,0.0,0.0,0.0
school_closures,"#keepyourchildhome... why? Unless they have a pre-existing condition (MOST understandable), their mortality rate rounds down to ZERO %. 

""Oh, but they could become carriers!"" Then... wear your mask, right? Social distance, right? 

I smell BS.",0,52.0,6.0,4.0,3.408135064134726,0.8269230769230769,0.7115384615384616,0.25,0.4423076923076923,0.23076923076923078,0.07692307692307693,0.038461538461538464,0.07692307692307693,0.09615384615384616,1.0,0.2857142857142857,0.23076923076923078,5.9,4.740487551109298,0.057692307692307696,0.18206349206349207,0.38539682539682546,0.34461620450019836,0.01009143702685833,0.5307583212852478,0.03572612255811691,0.0043509104289114475,0.06453170627355576,1.0,1.0,1.0,2.0,0.0,0.0,0.9331895709037781,33.0,0.0,0.0,0.0,2.0,0.9428571428571428,0.0,0.0,0.0,0.05714285714285714
school_closures,"Oh, boy! Praying for my daughter and her 2021 classmates! Looks like they will be robbed of a normal Senior year thanks to #COVID19 restrictions that are totally unnecessary! Stop this insanity!",0,38.0,4.0,4.2894736842105265,2.855354109635571,0.9210526315789473,0.8947368421052632,0.34210526315789475,0.15789473684210525,0.18421052631578946,0.15789473684210525,0.07894736842105263,0.02631578947368421,0.07894736842105263,1.0,0.34210526315789475,0.10526315789473684,6.3,6.745368781616021,0.05263157894736842,-0.09166666666666667,0.5833333333333334,0.2316756248474121,0.006466654594987631,0.12011842429637909,0.5225836038589478,0.0028253253549337387,0.10540930181741714,1.0,1.0,1.0,0.0,0.0,0.0,0.8785991072654724,32.0,0.0,0.0,0.0,0.0,1.0,0.0,0.0,0.0,0.0
school_closures,Y’all want schools to shutdown but your kids are all over the streets with no masks :unamused:,0,21.0,1.0,3.7142857142857144,2.1633936555429614,0.9047619047619048,0.8095238095238095,0.5238095238095238,0.09523809523809523,0.2857142857142857,0.14285714285714285,0.047619047619047616,0.0,0.047619047619047616,1.0,0.47368421052631576,0.0,5.2,0.0,0.09523809523809523,0.0,0.0,0.016032328829169273,0.005736599210649729,0.008182932622730732,0.6103227734565735,0.0022308724001049995,0.33487337827682495,0.0,1.0,0.0,0.0,0.0,0.0,0.0,17.0,0.0,0.0,0.0,0.0,1.0,0.0,0.0,0.0,0.0
school_closures,"#Democrat Leaders &amp; #Teachers Unions don't care about your children or your teachers. They're closing schools &amp; mandating elearning when the #Science demands the opposite. Children are least likely to catch #COVID19 &amp; spread it to teachers, parents, &amp; grandparents.",0,59.0,3.0,4.101694915254237,2.86826537820416,0.6779661016949152,0.5084745762711864,0.22033898305084745,0.3220338983050847,0.2711864406779661,0.1694915254237288,0.01694915254237288,0.05084745762711865,0.06779661016949153,1.0,0.2711864406779661,0.05084745762711865,7.3,1.247219128924647,0.06779661016949153,-0.09999999999999999,0.4666666666666666,0.7996264696121216,0.006659951526671648,0.10728296637535095,0.07605861127376556,0.0014822921948507428,0.005001069512218237,0.0,0.0,0.0,1.0,0.0,0.0,0.9631355404853821,39.0,0.0,1.0,0.0,0.0,0.975,0.0,0.025,0.0,0.0
school_closures,Anyone opposing the shut down of schools is crook.,0,10.0,1.0,4.2,2.181742422927143,1.0,1.0,0.4,0.1,0.4,0.2,0.0,0.0,0.0,1.0,0.5,0.1,3.3,0.0,0.0,-0.15555555555555556,0.2888888888888889,0.5442140102386475,0.0015215311432257295,0.06102634221315384,0.01421829592436552,0.3396851420402527,0.0016388364601880312,0.0,0.0,0.0,0.0,0.0,0.0,0.0,9.0,0.0,0.0,0.0,0.0,1.0,0.0,0.0,0.0,0.0
school_closures,"@dbongino As a teacher, I agree!!! The students are suffering without schools open and data shows there is very very low risk to kids. Teachers can mitigate risk to themselves and others. I need to teach my students where they thrive,  which is AT SCHOOL",0,53.0,4.0,3.943396226415094,2.468022616480136,0.7735849056603774,0.5849056603773585,0.4339622641509434,0.1509433962264151,0.2641509433962264,0.16981132075471697,0.03773584905660377,0.05660377358490566,0.09433962264150944,1.0,0.4716981132075472,0.09433962264150944,4.2,4.656984002549289,0.05660377358490566,0.0,0.445,0.08994290232658386,0.08105260878801346,0.19510293006896973,0.5802188515663147,0.0013406835496425629,0.0306354071944952,0.0,2.0,0.0,1.0,0.0,0.0,0.0,45.0,0.0,0.0,0.0,0.0,1.0,0.0,0.0,0.0,0.0
school_closures,I've been in online college classes. All yall are about to get dumb as fuck. #COVID19 #coronavirus,0,22.0,3.0,3.727272727272727,2.525898907172692,0.9090909090909091,0.8181818181818182,0.36363636363636365,0.22727272727272727,0.2727272727272727,0.18181818181818182,0.09090909090909091,0.0,0.045454545454545456,1.0,0.4782608695652174,0.09090909090909091,3.1,2.8674417556808756,0.045454545454545456,-0.3875,0.55,0.166375070810318,0.0030411751940846443,0.8130713105201721,0.012826244346797466,0.0010308177443221211,0.0021851586643606424,0.0,0.0,0.0,0.0,0.0,0.0,0.0,17.0,0.0,0.0,0.0,0.0,1.0,0.0,0.0,0.0,0.0
school_closures,"The govmnt is trying to prolong the closure of school so that they are able to “account” for the money that has already been looted. 

If schools close now, ba zo funa ichange ye mali e khiphiwe.",0,42.0,2.0,3.738095238095238,2.0823467051510693,0.9047619047619048,0.8095238095238095,0.40476190476190477,0.07142857142857142,0.35714285714285715,0.19047619047619047,0.023809523809523808,0.07142857142857142,0.023809523809523808,1.0,0.4186046511627907,0.047619047619047616,7.0,6.5,0.16666666666666666,0.5,0.625,0.2611786425113678,0.003997310064733028,0.0310977790504694,0.21114841103553772,0.06559641659259796,0.03688230365514755,0.0,0.0,0.0,1.0,0.0,0.0,0.9688783884048462,36.0,0.0,0.0,0.0,1.0,0.972972972972973,0.0,0.0,0.0,0.02702702702702703
school_closures,"Teachers don’t want to return

But health care, daycare, and essential workers have worked for months. 
What’s the difference?
I honestly don’t understand the resistance.
#WearAMask
#COVID19
#TeacherSafetyIsEssential
#teacher
#SchoolReopening",0,46.0,4.0,4.586956521739131,4.450579283040734,0.7608695652173914,0.6086956521739131,0.30434782608695654,0.21739130434782608,0.2826086956521739,0.21739130434782608,0.06521739130434782,0.043478260869565216,0.021739130434782608,1.0,0.27450980392156865,0.06521739130434782,8.6,5.024937810560445,0.043478260869565216,0.3,0.6,0.04481297731399536,0.0025818743743002415,0.9217225313186646,0.021901683881878853,0.0004962094826623797,0.006669610273092985,1.0,2.0,0.0,0.0,0.0,1.0,0.0,30.0,0.0,0.0,0.0,0.0,1.0,0.0,0.0,0.0,0.0
school_closures,"Children need schools, schools need children!",0,8.0,1.0,5.0,2.7386127875258306,0.75,0.5,0.0,0.25,0.5,0.125,0.0,0.0,0.0,1.0,0.0,0.125,2.1,0.0,0.125,0.0,0.0,0.34355151653289795,0.2362852245569229,0.015092747285962105,0.03039812296628952,0.020692070946097374,0.12212195992469788,0.0,1.0,0.0,0.0,0.0,0.0,0.0,6.0,0.0,0.0,0.0,0.0,1.0,0.0,0.0,0.0,0.0
school_closures,"No fees, no classes, 
No classes, no work.
No work, no idea invent.
All of working now, teacher and student.
 
Schools have to pay salary.",0,34.0,4.0,3.264705882352941,2.1734876219814487,0.6176470588235294,0.4411764705882353,0.35294117647058826,0.2647058823529412,0.35294117647058826,0.08823529411764706,0.0,0.029411764705882353,0.0,1.0,0.3157894736842105,0.11764705882352941,1.0,1.299038105676658,0.029411764705882353,0.0,0.0,0.09806445240974426,0.008373488672077656,0.06928401440382004,0.3735749423503876,0.07914648205041885,0.19238293170928955,0.0,0.0,0.0,0.0,0.0,1.0,0.0,25.0,0.0,0.0,0.0,0.0,1.0,0.0,0.0,0.0,0.0
school_closures,"@NYCMayorsOffice Follow the science, you anti Americans.  Your should be sued for not opening the schools. #DeBlasioResign #WorstMayor #DemocratsHateAmerica",0,26.0,3.0,5.269230769230769,4.816299986725305,0.8461538461538461,0.7307692307692307,0.3076923076923077,0.2692307692307692,0.2692307692307692,0.15384615384615385,0.038461538461538464,0.038461538461538464,0.07692307692307693,1.0,0.3076923076923077,0.07692307692307693,10.5,2.494438257849294,0.038461538461538464,0.0,0.0,0.8274374604225159,0.0046041859313845634,0.15064403414726257,0.01324212271720171,0.0023397919721901417,0.0012387691531330347,0.0,0.0,0.0,1.0,0.0,0.0,0.0,19.0,0.0,0.0,0.0,0.0,1.0,0.0,0.0,0.0,0.0
school_closures,Guess who's going to be hurt the most by keeping schools closed? Ding... ding... ding.... all they want to do is keep the divide and keep the classes separated.,0,35.0,2.0,3.7714285714285714,1.8061120719176125,0.8285714285714286,0.6857142857142857,0.4,0.37142857142857144,0.11428571428571428,0.42857142857142855,0.0,0.02857142857142857,0.02857142857142857,1.0,0.4857142857142857,0.34285714285714286,4.2,2.5,0.14285714285714285,0.2,0.3,0.037192124873399734,0.017525993287563324,0.007367534097284079,0.37408798933029175,0.13614220917224884,0.0962497889995575,0.0,1.0,0.0,1.0,0.0,0.0,0.0,29.0,0.0,0.0,0.0,0.0,1.0,0.0,0.0,0.0,0.0
school_closures,Almost 15 Lakh teachers are unemployed due to closure of schools.,0,12.0,1.0,4.583333333333333,2.782634642844,1.0,1.0,0.25,0.08333333333333333,0.25,0.08333333333333333,0.25,0.08333333333333333,0.0,1.0,0.4166666666666667,0.08333333333333333,6.4,0.0,0.0,-0.125,0.375,0.01586933806538582,0.0013347221538424492,0.007099491078406572,0.9151798486709595,0.021139878779649734,0.0057360404171049595,0.0,0.0,0.0,0.0,0.0,0.0,0.0,11.0,0.0,0.0,0.0,0.0,1.0,0.0,0.0,0.0,0.0
school_closures,Take sports away and Social Interaction in schools. Your kids will have a great immune system! Way to teach your kids your saving them from the coronavirus. Bill gates and all Ted Talk technocrats have wanted online learning for years. Wake up!,0,47.0,5.0,4.319148936170213,2.4066077739876968,0.851063829787234,0.723404255319149,0.3617021276595745,0.10638297872340426,0.2765957446808511,0.19148936170212766,0.0425531914893617,0.02127659574468085,0.0851063829787234,1.0,0.3829787234042553,0.10638297872340426,3.8,3.7202150475476548,0.02127659574468085,0.5166666666666667,0.4083333333333333,0.19326119124889374,0.057705868035554886,0.037300750613212585,0.014627736993134022,0.014237823896110058,0.04762553423643112,0.0,0.0,2.0,0.0,0.0,1.0,0.0,42.0,0.0,0.0,0.0,0.0,1.0,0.0,0.0,0.0,0.0
school_closures,"How can you go from saying that the biggest protests in the history of the US didn’t cause a spike in coronavirus cases, to saying there isn’t a safe way to send kids back to school? Just require masks. They were good enough for the mass protests.",0,55.0,3.0,3.6545454545454548,2.1508406966763807,0.7818181818181819,0.6181818181818182,0.4727272727272727,0.07272727272727272,0.36363636363636365,0.09090909090909091,0.07272727272727272,0.05454545454545454,0.03636363636363636,1.0,0.5660377358490566,0.05454545454545454,4.7,14.522013940527977,0.05454545454545454,0.3,0.4,0.07003538310527802,0.005947236903011799,0.0068871392868459225,0.002650299109518528,0.033502526581287384,0.030080167576670647,0.0,0.0,1.0,1.0,0.0,0.0,0.0,47.0,0.0,0.0,0.0,0.0,1.0,0.0,0.0,0.0,0.0
