target,text,stance,word_count,sentence_count,avg_word_length,std_word_length,type_token_ratio,hapax_legomena,stopword_ratio,punctuation_density,noun_ratio,verb_ratio,adj_ratio,adv_ratio,pronoun_ratio,avg_dependency_depth,function_word_ratio,punctuation_usage,readability_score,sentence_length_variation,subordinate_clause_ratio,sentiment_polarity,sentiment_subjectivity,anger,joy,fear,sadness,disgust,surprise,certainty_adverbs_count,certainty_verbs_count,certainty_adjectives_count,doubt_adverbs_count,doubt_verbs_count,doubt_adjectives_count,hedges_score,hedge_C_count,hedge_D_count,hedge_E_count,hedge_I_count,hedge_N_count,C_ratio,D_ratio,E_ratio,I_ratio,N_ratio
school_closures,"Why do you never actually declare that Black Lives Matter in your statement, and instead issue a thinly veiled “all lives matter” statement disguised as, “every life matters”? 

#resist #BLM #BlackLivesMatter",2,41.0,2.0,4.2926829268292686,3.125379215539775,0.8536585365853658,0.7317073170731707,0.24390243902439024,0.14634146341463414,0.2682926829268293,0.17073170731707318,0.024390243902439025,0.0975609756097561,0.04878048780487805,1.0,0.2857142857142857,0.024390243902439025,9.3,12.5,0.0975609756097561,-0.18888888888888888,0.4611111111111111,0.5250269174575806,0.04853728041052818,0.4079088270664215,0.01229251641780138,0.001279103453271091,0.0031767901964485645,1.0,0.0,0.0,0.0,1.0,0.0,0.0,31.0,0.0,0.0,0.0,0.0,1.0,0.0,0.0,0.0,0.0
school_closures,"@KarluskaP It's a flu, get over yourself!  Take #Hydroxycloroquine if you're worried.",2,19.0,2.0,3.8421052631578947,3.896869970613215,1.0,1.0,0.3157894736842105,0.3684210526315789,0.21052631578947367,0.21052631578947367,0.05263157894736842,0.0,0.15789473684210525,1.0,0.5263157894736842,0.10526315789473684,5.6,1.0,0.10526315789473684,0.0,0.0,0.0022989974822849035,0.0017883672844618559,0.9846077561378479,0.005615601781755686,0.00014010722225066274,0.002789539285004139,0.0,0.0,0.0,0.0,0.0,0.0,0.8978412747383118,11.0,0.0,0.0,0.0,1.0,0.9166666666666666,0.0,0.0,0.0,0.08333333333333333
school_closures,Teachers are humans too. We need salaries. And decent ones are enough. This lockdown has been heavy on all of us and we need to come together as a community instead of promoting disharmony. The school is a sacred institution. It cannot be equated with profits.,2,53.0,6.0,4.056603773584905,2.652269191064993,0.8301886792452831,0.7358490566037735,0.4716981132075472,0.11320754716981132,0.18867924528301888,0.22641509433962265,0.03773584905660377,0.09433962264150944,0.07547169811320754,1.0,0.5283018867924528,0.11320754716981132,5.1,6.497862896539309,0.018867924528301886,-0.011111111111111118,0.5555555555555555,0.03139537200331688,0.003425996983423829,0.02880527824163437,0.015014630742371082,0.040838006883859634,0.003646633354946971,0.0,1.0,1.0,1.0,0.0,0.0,0.0,46.0,0.0,0.0,0.0,0.0,1.0,0.0,0.0,0.0,0.0
school_closures,"#Towson has announced that beginning Wednesday (3/11) through Friday (3/13) they will cancel all university classes on all campuses to prepare for potential remote teaching, learning and working after spring break. 

#COVID19 #COVID2019 #MD",2,44.0,2.0,4.659090909090909,2.8757859148586102,0.8636363636363636,0.7727272727272727,0.2727272727272727,0.2727272727272727,0.29545454545454547,0.1590909090909091,0.022727272727272728,0.0,0.022727272727272728,1.0,0.26666666666666666,0.022727272727272728,9.9,14.0,0.06818181818181818,-0.05,0.6,0.06632104516029358,0.00455968314781785,0.7677189707756042,0.1423429697751999,0.0010262173600494862,0.009714322164654732,0.0,0.0,1.0,0.0,0.0,0.0,0.0,34.0,0.0,0.0,0.0,0.0,1.0,0.0,0.0,0.0,0.0
school_closures,"@Tges_Official Parents should have a right to choose the format of their children's education, especially in such uncertain times. We don't know when #schools will open, so there have to exist various avenues for children to continue their #education",2,47.0,2.0,4.51063829787234,2.8574079939063055,0.8297872340425532,0.6808510638297872,0.425531914893617,0.19148936170212766,0.23404255319148937,0.1702127659574468,0.0851063829787234,0.06382978723404255,0.06382978723404255,1.0,0.5,0.02127659574468085,10.9,0.5,0.10638297872340426,0.07142857142857142,0.6339285714285714,0.0014602799201384187,0.00221580034121871,0.9920788407325745,0.0030181186739355326,0.00017144918092526495,0.0005869399756193161,1.0,2.0,1.0,3.0,0.0,0.0,0.0,39.0,0.0,0.0,0.0,0.0,1.0,0.0,0.0,0.0,0.0
school_closures,"Educational Department said that many schools have either not paid any salary or paid only 40-50% salary to their staff during the period of the lockdown. But I have received 100% salary, on time. Thanks to @J G International School",2,46.0,3.0,4.195652173913044,2.7474855320059883,0.8260869565217391,0.6739130434782609,0.3695652173913043,0.15217391304347827,0.32608695652173914,0.15217391304347827,0.06521739130434782,0.043478260869565216,0.043478260869565216,1.0,0.40425531914893614,0.043478260869565216,6.1,8.993825042154695,0.043478260869565216,0.19,0.39,0.0558646060526371,0.046932924538850784,0.7404623031616211,0.037988193333148956,0.0016812165267765522,0.055768080055713654,0.0,0.0,0.0,0.0,0.0,0.0,0.0,40.0,0.0,0.0,0.0,0.0,1.0,0.0,0.0,0.0,0.0
school_closures,"Stay at home if you have #coronavirus symptoms

Stay at home for7days if you have either:

a high temperature
a new continuous cough

Do not go to a GP surgery, pharmacy or hospital

You do not need to contact 111 to tell them you're staying at home
#Birmingham",2,53.0,1.0,3.9622641509433962,2.7123913013674326,0.7169811320754716,0.5283018867924528,0.4339622641509434,0.09433962264150944,0.3018867924528302,0.16981132075471697,0.05660377358490566,0.03773584905660377,0.09433962264150944,1.0,0.4406779661016949,0.0,19.6,0.0,0.16981132075471697,0.1481818181818182,0.4972727272727273,0.011860597878694534,0.0017843300011008978,0.9475715160369873,0.022353947162628174,0.0009310742025263608,0.004134359769523144,0.0,1.0,0.0,0.0,0.0,2.0,0.9035260677337646,46.0,0.0,0.0,0.0,2.0,0.9583333333333334,0.0,0.0,0.0,0.041666666666666664
school_closures,"If all are adopting  new techniques  of working  than why private schools  can not?  
Please think over the resolution made on ' No school No fees'. We teachers  are working  hard beyond our boundaries, leaving all personal family responsibilities to serve kids.",2,47.0,3.0,4.531914893617022,3.065602324140915,0.8723404255319149,0.7446808510638298,0.3829787234042553,0.1276595744680851,0.2553191489361702,0.19148936170212766,0.06382978723404255,0.06382978723404255,0.0425531914893617,1.0,0.3888888888888889,0.06382978723404255,7.5,1.632993161855452,0.06382978723404255,-0.03882575757575758,0.4178030303030303,0.06420719623565674,0.037661463022232056,0.11907348781824112,0.24318762123584747,0.006687935907393694,0.32532352209091187,0.0,2.0,0.0,0.0,0.0,0.0,0.9672667384147644,41.0,0.0,0.0,0.0,1.0,0.9761904761904762,0.0,0.0,0.0,0.023809523809523808
school_closures,"The  beautiful  learning  process  should  not  stop.  It's  essential  to  revise  the  education  system, check  loopholes,  make  corrections  &amp;  carry  forward  necessary  steps  to  nurture  young  minds.But, start  with  supporting  schools  &amp;  teachers",2,42.0,2.0,4.880952380952381,3.009527576851168,0.8571428571428571,0.7380952380952381,0.19047619047619047,0.23809523809523808,0.30952380952380953,0.14285714285714285,0.11904761904761904,0.047619047619047616,0.023809523809523808,1.0,0.14864864864864866,0.047619047619047616,8.8,9.5,0.047619047619047616,0.24,0.59,0.025623744353652,0.4492426812648773,0.013227783143520355,0.38058796525001526,0.0016124132089316845,0.049486856907606125,1.0,1.0,1.0,1.0,0.0,0.0,0.0,33.0,0.0,0.0,0.0,0.0,1.0,0.0,0.0,0.0,0.0
school_closures,"@MedicVet68 Wow. The #TrumpMurder was worse than I thought. 
His #TrumpVirus is killing thousands. 
He is trying to kill as many as possible with a systematic #TrumpGenocide .
How many have to die before he is stopped.",2,45.0,5.0,4.0,3.183289703016886,0.7555555555555555,0.6222222222222222,0.4222222222222222,0.2,0.15555555555555556,0.24444444444444444,0.13333333333333333,0.022222222222222223,0.08888888888888889,1.0,0.44680851063829785,0.1111111111111111,3.3,4.029888335921977,0.13333333333333333,0.13999999999999999,0.72,0.004292934667319059,0.0007884030346758664,0.989425778388977,0.003860840341076255,0.00038578349631279707,0.000994409085251391,1.0,1.0,0.0,1.0,0.0,2.0,0.0,37.0,0.0,0.0,0.0,0.0,1.0,0.0,0.0,0.0,0.0
school_closures,"@Zee24Kalak @DixitGujarat Do you think its right for the Gujarat Government to stop Private UnAided Schools from charging any fees till they reopen, while teachers are teaching online?

Looking forward to hear your thoughts?",2,39.0,2.0,4.871794871794871,2.765904935417806,0.9230769230769231,0.8461538461538461,0.3333333333333333,0.1282051282051282,0.3333333333333333,0.2564102564102564,0.02564102564102564,0.02564102564102564,0.10256410256410256,1.0,0.34210526315789475,0.05128205128205128,8.7,11.0,0.1794871794871795,0.14285714285714285,0.45535714285714285,0.1474134922027588,0.058388203382492065,0.5317391753196716,0.06461294740438461,0.000515301595441997,0.13971905410289764,0.0,2.0,0.0,1.0,0.0,0.0,0.9612346291542053,33.0,1.0,0.0,0.0,0.0,0.9705882352941176,0.029411764705882353,0.0,0.0,0.0
school_closures,@JayeetaBasu7 @imBhupendrasinh @CMOGuj Yes indeed and this will only be possible if capable parents pay the dues on time and be helpful in this direction. They should be allowed to pay and Schools should be allowed to Collect Fees.,2,44.0,2.0,4.386363636363637,2.9635352743495478,0.7045454545454546,0.5,0.45454545454545453,0.11363636363636363,0.2727272727272727,0.20454545454545456,0.09090909090909091,0.045454545454545456,0.022727272727272728,1.0,0.5121951219512195,0.045454545454545456,9.7,5.5,0.09090909090909091,0.06666666666666667,0.7999999999999999,0.28497299551963806,0.3490520119667053,0.1937226504087448,0.0542021282017231,0.0007511504809372127,0.04724506661295891,2.0,0.0,1.0,2.0,0.0,0.0,0.9688102006912231,35.0,0.0,0.0,0.0,4.0,0.8974358974358975,0.0,0.0,0.0,0.10256410256410256
school_closures,"Most vulnerable populations is code word for populations that need to be policed the most. 
#BetsyDeVos ",2,18.0,2.0,4.833333333333333,3.320809807528546,0.9444444444444444,0.8888888888888888,0.4444444444444444,0.1111111111111111,0.2222222222222222,0.2222222222222222,0.16666666666666666,0.05555555555555555,0.0,1.0,0.42105263157894735,0.05555555555555555,11.9,7.0,0.05555555555555555,0.16666666666666666,0.5,0.01880049705505371,0.0015196043532341719,0.9724888205528259,0.0040048956871032715,0.0009010795620270073,0.0008160821162164211,0.0,1.0,1.0,1.0,0.0,0.0,0.0,16.0,0.0,0.0,0.0,0.0,1.0,0.0,0.0,0.0,0.0
school_closures,"@dougmarcus @GovMurphy So many people have died in this state from smoking marijuana and then being suffocated by their mask after passing out. Murphy supports free pot and masks, yet people like you are enablers #GatewayDrug #JustSayNoToMasks",2,43.0,2.0,4.813953488372093,3.1494245613451533,0.9069767441860465,0.813953488372093,0.3488372093023256,0.13953488372093023,0.3488372093023256,0.18604651162790697,0.06976744186046512,0.046511627906976744,0.046511627906976744,1.0,0.4146341463414634,0.023255813953488372,10.5,4.5,0.0,0.45,0.65,0.04353377968072891,0.004098543431609869,0.8825104832649231,0.06583940982818604,0.0008690450922586024,0.0022200741805136204,0.0,1.0,0.0,1.0,0.0,0.0,0.0,37.0,0.0,0.0,0.0,0.0,1.0,0.0,0.0,0.0,0.0
school_closures,@nick_ramsey can't she just email the binder out to everyone and skip the propaganda sessions?  #PropagandaBarbie #TrumpFailedAmerica #TrumpVirus #ETTD,2,26.0,2.0,5.076923076923077,4.5397651322090775,0.8461538461538461,0.7692307692307693,0.2692307692307692,0.3076923076923077,0.38461538461538464,0.07692307692307693,0.0,0.07692307692307693,0.038461538461538464,1.0,0.38461538461538464,0.038461538461538464,9.4,5.5,0.0,-0.1,0.1,0.019056830555200577,0.0037099740002304316,0.9722557663917542,0.003055623732507229,0.00027670161216519773,0.001131648663431406,0.0,0.0,1.0,0.0,0.0,0.0,0.0,19.0,0.0,0.0,0.0,0.0,1.0,0.0,0.0,0.0,0.0
school_closures,"Virtual classes cannot replace physical schools but it does solve the purpose of engaging with students,its only alternative to continue with learning despite the lockdown.",2,29.0,1.0,5.103448275862069,2.6306525686566413,0.9310344827586207,0.8620689655172413,0.4482758620689655,0.06896551724137931,0.1724137931034483,0.20689655172413793,0.10344827586206896,0.06896551724137931,0.06896551724137931,1.0,0.4482758620689655,0.034482758620689655,15.4,0.0,0.0,0.13333333333333333,0.6142857142857142,0.011137950234115124,0.01409901026636362,0.06472671031951904,0.023089079186320305,0.017423154786229134,0.011984278447926044,0.0,0.0,1.0,0.0,0.0,0.0,0.0,25.0,0.0,0.0,0.0,0.0,1.0,0.0,0.0,0.0,0.0
school_closures,save schools save teachers,2,4.0,1.0,5.75,1.7853571071357126,0.75,0.5,0.0,0.0,0.75,0.25,0.0,0.0,0.0,1.0,0.0,0.0,1.3,0.0,0.0,0.0,0.0,0.027440182864665985,0.025449614971876144,0.0334063321352005,0.2858016788959503,0.003531476017087698,0.08661410212516785,0.0,0.0,0.0,0.0,0.0,0.0,0.0,4.0,0.0,0.0,0.0,0.0,1.0,0.0,0.0,0.0,0.0
school_closures,I received a call yesterday from Batho Pele Vastfontein Christian School. In my son's class they have a case and now he is in 14 days quarantine.,2,30.0,2.0,3.966666666666667,2.786674641136915,0.9333333333333333,0.8666666666666667,0.43333333333333335,0.1,0.4,0.1,0.0,0.03333333333333333,0.13333333333333333,1.0,0.5,0.06666666666666667,5.0,2.5,0.0,0.0,0.0,0.023416901007294655,0.004880720283836126,0.19380462169647217,0.48511049151420593,0.04239560663700104,0.024394501000642776,0.0,0.0,0.0,0.0,0.0,0.0,0.0,27.0,0.0,0.0,0.0,0.0,1.0,0.0,0.0,0.0,0.0
school_closures,@kavita_anand @TTFMaya @AmitCTweets @nebuer42 @Meetasengupta @james_tooley @DeAngelisCorey @Francis_Joseph @AgarkarFatima @KBSfed @TVMohandasPai @swarup58 @nexusofgood Focus needs 2be on quality &amp; accountability irrespective of who the provider is. It’s shocking that as per @CSF_India recent report that 75p of #students in urban India choose fee paying private schools over FOC Govt. Separate Govt role as provider &amp; regulator,2,79.0,3.0,4.822784810126582,3.9770210009881652,0.7215189873417721,0.5949367088607594,0.17721518987341772,0.31645569620253167,0.5443037974683544,0.08860759493670886,0.0759493670886076,0.0,0.012658227848101266,1.0,0.234375,0.02531645569620253,14.1,8.339997335464536,0.0759493670886076,-0.25,0.40625,0.009671547450125217,0.00932584423571825,0.899742603302002,0.004510556347668171,0.0003754598437808454,0.0743652731180191,0.0,0.0,0.0,0.0,0.0,1.0,0.0,44.0,0.0,0.0,0.0,0.0,1.0,0.0,0.0,0.0,0.0
school_closures,"@mgchoksi @UdgamSchool @PMOIndia @CMOGuj does goverment wave off the eletricity bill, or petrol pump charges, gas charges, NO...then why to stop schools from collecting the fees? They are helping students study..this is unfare",2,45.0,2.0,4.311111111111111,2.73919876543182,0.8444444444444444,0.7555555555555555,0.3111111111111111,0.28888888888888886,0.4,0.2222222222222222,0.044444444444444446,0.022222222222222223,0.022222222222222223,1.0,0.34146341463414637,0.13333333333333333,4.2,9.5,0.044444444444444446,0.0,0.0,0.44592201709747314,0.012358192354440689,0.5068793892860413,0.01771547831594944,0.00042878196109086275,0.013263204135000706,0.0,0.0,0.0,0.0,0.0,0.0,0.0,33.0,0.0,0.0,0.0,0.0,1.0,0.0,0.0,0.0,0.0
school_closures,So finally people start to realize that Coronavirus isn’t a joke,2,13.0,1.0,4.153846153846154,2.8781979898261087,1.0,1.0,0.46153846153846156,0.0,0.3076923076923077,0.3076923076923077,0.0,0.15384615384615385,0.0,1.0,0.5,0.0,8.8,0.0,0.23076923076923078,0.0,1.0,0.027018249034881592,0.07581624388694763,0.007136657368391752,0.006272435188293457,0.017149420455098152,0.16095834970474243,1.0,1.0,0.0,1.0,0.0,0.0,0.0,11.0,0.0,0.0,0.0,0.0,1.0,0.0,0.0,0.0,0.0
school_closures,"@Yamiche Thank goodness ! We’ve heard more than enough from that character. He hasn’t been right about anything. Took a federal paycheck for more than 3 decades and just plays Monday morning quarterback. Fraud.
#Trump2020LandslideVictory 
#ChineseVirus #riots",2,49.0,6.0,4.530612244897959,4.051213175899876,0.8367346938775511,0.7346938775510204,0.3469387755102041,0.1836734693877551,0.32653061224489793,0.10204081632653061,0.10204081632653061,0.08163265306122448,0.04081632653061224,1.0,0.3958333333333333,0.10204081632653061,6.1,4.524623986832742,0.0,0.3214285714285714,0.5089285714285714,0.07858823239803314,0.004117163829505444,0.9016663432121277,0.009118564426898956,0.00042740273056551814,0.004392279777675867,0.0,2.0,1.0,1.0,0.0,0.0,0.0,37.0,0.0,0.0,0.0,0.0,1.0,0.0,0.0,0.0,0.0
school_closures,"@ecaorg @imBhupendrasinh @CMOGuj @vijayrupanibjp @swatipopat Correct... It should be a Win - Win - Win situation for all three - Parents, kids and schools",2,31.0,2.0,4.225806451612903,3.7044844438595073,0.7419354838709677,0.6451612903225806,0.22580645161290322,0.3870967741935484,0.5483870967741935,0.03225806451612903,0.03225806451612903,0.0,0.03225806451612903,1.0,0.3076923076923077,0.0967741935483871,7.4,6.0,0.0,0.8000000000000002,0.4000000000000001,0.16076432168483734,0.42184266448020935,0.1102147027850151,0.052350617945194244,0.0009648894192650914,0.15234120190143585,0.0,0.0,0.0,1.0,0.0,0.0,0.0,24.0,0.0,0.0,0.0,0.0,1.0,0.0,0.0,0.0,0.0
school_closures,I’m not sure what the right answer is on schools opening.  We need a better debate than privileged people and/or those with no school age children adamantly against it vs. an incompetent president blindly pushing for it.,2,41.0,2.0,4.463414634146342,2.705888438704129,0.9512195121951219,0.9024390243902439,0.43902439024390244,0.0975609756097561,0.21951219512195122,0.17073170731707318,0.07317073170731707,0.07317073170731707,0.0975609756097561,1.0,0.43902439024390244,0.07317073170731707,6.9,7.5,0.024390243902439025,-0.03571428571428572,0.6096560846560846,0.07967239618301392,0.005970826838165522,0.33789151906967163,0.07634028047323227,0.018897661939263344,0.054914165288209915,1.0,2.0,2.0,0.0,0.0,0.0,0.0,36.0,0.0,1.0,0.0,0.0,0.972972972972973,0.0,0.02702702702702703,0.0,0.0
school_closures,Why don’t the small percentage of parents who feel that online education is useless withdraw their children from private schools and admit them in free govt. schools with highly paid and qualified teachers? Why make majority of parents and students suffer?,2,46.0,3.0,4.695652173913044,2.474825994914384,0.8478260869565217,0.717391304347826,0.391304347826087,0.06521739130434782,0.2826086956521739,0.17391304347826086,0.10869565217391304,0.021739130434782608,0.043478260869565216,1.0,0.4222222222222222,0.06521739130434782,7.5,8.73053390247253,0.06521739130434782,-0.03799999999999999,0.4630000000000001,0.5130659341812134,0.0011522859567776322,0.012055912055075169,0.17472238838672638,0.23372210562229156,0.012970179319381714,1.0,1.0,0.0,0.0,0.0,0.0,0.0,41.0,0.0,0.0,0.0,0.0,1.0,0.0,0.0,0.0,0.0
school_closures,So just got a survey call about opening schools in Idaho.  Some interesting questions to say the least.,2,20.0,2.0,4.25,2.6433879775772606,0.95,0.9,0.4,0.1,0.25,0.15,0.1,0.1,0.0,1.0,0.5238095238095238,0.1,4.4,2.0,0.0,0.1,0.45,0.005815903656184673,0.2990952134132385,0.003186724614351988,0.00788001250475645,0.00566141540184617,0.1864541918039322,1.0,0.0,1.0,1.0,0.0,0.0,0.0,18.0,0.0,0.0,0.0,0.0,1.0,0.0,0.0,0.0,0.0
school_closures,"I believe Indian schools only create robots, people should rather get into home school, so their perception and vision remains organic.",2,24.0,1.0,4.791666666666667,2.344837710565251,0.9583333333333334,0.9166666666666666,0.2916666666666667,0.125,0.2916666666666667,0.16666666666666666,0.08333333333333333,0.08333333333333333,0.08333333333333333,1.0,0.375,0.041666666666666664,12.7,0.0,0.125,0.0,1.0,0.00797968078404665,0.0037333336658775806,0.0027867441531270742,0.002797938184812665,0.014157933183014393,0.017649289220571518,0.0,1.0,0.0,3.0,0.0,0.0,0.971031129360199,20.0,1.0,0.0,0.0,0.0,0.9523809523809523,0.047619047619047616,0.0,0.0,0.0
school_closures,"@CDCDirector , so you caved. Got it...#CDCTrumpVirus #TrumpVirus",2,14.0,2.0,4.071428571428571,3.9904222067038346,0.9285714285714286,0.8571428571428571,0.21428571428571427,0.5714285714285714,0.21428571428571427,0.14285714285714285,0.07142857142857142,0.0,0.14285714285714285,1.0,0.25,0.2857142857142857,7.2,1.0,0.0,0.0,0.0,0.18082547187805176,0.005571585614234209,0.6973587870597839,0.04501833766698837,0.0014965615700930357,0.025331776589155197,0.0,0.0,0.0,1.0,0.0,0.0,0.0,8.0,0.0,0.0,0.0,0.0,1.0,0.0,0.0,0.0,0.0
school_closures,School is said to be our 2 home. If home needs to maintained than even schools need maintenance. No fees is no solution.,2,26.0,3.0,3.769230769230769,2.650220488761879,0.8076923076923077,0.6538461538461539,0.38461538461538464,0.11538461538461539,0.3076923076923077,0.23076923076923078,0.0,0.038461538461538464,0.038461538461538464,1.0,0.4230769230769231,0.11538461538461539,1.6,2.0548046676563256,0.19230769230769232,0.0,0.0,0.01610211469233036,0.010020379908382893,0.0026473072357475758,0.08283353596925735,0.014114757999777794,0.05777536705136299,0.0,1.0,0.0,0.0,0.0,1.0,0.9667631983757019,22.0,0.0,0.0,0.0,1.0,0.9565217391304348,0.0,0.0,0.0,0.043478260869565216
school_closures,"@jaketapper @deutsch29blog Come on, everybody! Let’s be fair! This is only the person and regime that gaslights about everything! Above all, we must exceed journalistic integrity when confronted by a known liar! #arpx #COVID19",2,46.0,5.0,4.195652173913044,3.2678909913261984,0.8695652173913043,0.782608695652174,0.34782608695652173,0.21739130434782608,0.2608695652173913,0.17391304347826086,0.08695652173913043,0.021739130434782608,0.021739130434782608,1.0,0.4186046511627907,0.08695652173913043,5.4,4.4,0.043478260869565216,0.2916666666666667,0.6666666666666666,0.07495460659265518,0.00595657667145133,0.9121409058570862,0.0024561425670981407,0.0003488906950224191,0.0027939965948462486,1.0,1.0,0.0,0.0,0.0,0.0,0.0,34.0,0.0,0.0,0.0,0.0,1.0,0.0,0.0,0.0,0.0
school_closures,Has this panemic time not affected schools and teachers? Central govt when says that nobody's salary should be cut or revamp then why this does not apply to teachers and school staff??,2,36.0,3.0,4.25,2.0052015692526606,0.8333333333333334,0.6944444444444444,0.4444444444444444,0.1111111111111111,0.2777777777777778,0.19444444444444445,0.05555555555555555,0.08333333333333333,0.0,1.0,0.5,0.08333333333333333,6.0,9.092121131323903,0.05555555555555555,0.0,0.25,0.08915819227695465,0.0012503929901868105,0.028873872011899948,0.011520501226186752,0.01721980795264244,0.6956472992897034,0.0,0.0,1.0,1.0,0.0,1.0,0.0,32.0,0.0,0.0,0.0,0.0,1.0,0.0,0.0,0.0,0.0
school_closures,"Its not a big deal if one year schools don't charge fees.

Its ok if students don't study for a year

Its ok if parents want to save on that money and enjoy vacation at home for a year. 

This is exactly why we need EDUCATION.

Leads us from darkness to light",2,57.0,4.0,3.56140350877193,1.9647556328535603,0.7368421052631579,0.5614035087719298,0.43859649122807015,0.08771929824561403,0.2631578947368421,0.17543859649122806,0.03508771929824561,0.07017543859649122,0.08771929824561403,1.0,0.47540983606557374,0.05263157894736842,3.6,8.396427811873332,0.14035087719298245,0.3416666666666666,0.425,0.0200489591807127,0.10854612290859222,0.055540814995765686,0.22626931965351105,0.007398941554129124,0.030465280637145042,1.0,2.0,0.0,0.0,0.0,1.0,0.9699631333351135,49.0,0.0,0.0,0.0,3.0,0.9423076923076923,0.0,0.0,0.0,0.057692307692307696
school_closures,@columbusmonthly Guess what. Schools closed for 1 MONTH,2,10.0,2.0,4.8,3.9698866482558417,1.0,1.0,0.2,0.2,0.4,0.1,0.0,0.1,0.0,1.0,0.2222222222222222,0.1,2.5,1.0,0.0,-0.1,0.1,0.006710551679134369,0.009239270351827145,0.0031955442391335964,0.7165213227272034,0.0006785989971831441,0.22428372502326965,0.0,0.0,0.0,0.0,0.0,0.0,0.0,8.0,0.0,0.0,0.0,0.0,1.0,0.0,0.0,0.0,0.0
school_closures,@ClayTravis @JohnCooper4Nash It’s not about masks. It’s about the Teachers Union twisting the tax payers arm for more money. Where does it all end?  Money obviously doesn’t fix failing government schools.,2,43.0,4.0,4.023255813953488,3.0840050379488853,0.7906976744186046,0.627906976744186,0.3953488372093023,0.13953488372093023,0.32558139534883723,0.16279069767441862,0.11627906976744186,0.046511627906976744,0.06976744186046512,1.0,0.4358974358974359,0.09302325581395349,5.2,3.112474899497183,0.023255813953488372,0.25,0.5,0.4295147955417633,0.01016113068908453,0.5157935619354248,0.029998665675520897,0.0004920667852275074,0.008677059784531593,0.0,0.0,0.0,0.0,0.0,0.0,0.0,31.0,0.0,0.0,0.0,0.0,1.0,0.0,0.0,0.0,0.0
school_closures,doing my college a solid just emailed in saying i’ve self isolated and only had corona virus for like 7-8 days now so should be ok :blush: don’t thank me yet #COVID2019uk,2,39.0,1.0,3.5641025641025643,2.262230256421823,0.9487179487179487,0.8974358974358975,0.46153846153846156,0.10256410256410256,0.23076923076923078,0.20512820512820512,0.1282051282051282,0.1282051282051282,0.05128205128205128,1.0,0.48717948717948717,0.0,12.2,0.0,0.07692307692307693,0.16666666666666666,0.5333333333333333,0.038697194308042526,0.028424439951777458,0.09099934995174408,0.6400803923606873,0.0005544900777749717,0.136837437748909,0.0,2.0,1.0,2.0,0.0,0.0,0.0,32.0,0.0,0.0,0.0,0.0,1.0,0.0,0.0,0.0,0.0
