target,text,stance,word_count,sentence_count,avg_word_length,std_word_length,type_token_ratio,hapax_legomena,stopword_ratio,punctuation_density,noun_ratio,verb_ratio,adj_ratio,adv_ratio,pronoun_ratio,avg_dependency_depth,function_word_ratio,punctuation_usage,readability_score,sentence_length_variation,subordinate_clause_ratio,sentiment_polarity,sentiment_subjectivity,anger,joy,fear,sadness,disgust,surprise,certainty_adverbs_count,certainty_verbs_count,certainty_adjectives_count,doubt_adverbs_count,doubt_verbs_count,doubt_adjectives_count,hedges_score,hedge_C_count,hedge_D_count,hedge_E_count,hedge_I_count,hedge_N_count,C_ratio,D_ratio,E_ratio,I_ratio,N_ratio
school_closures,@donwinslow So glad Dekalb County schools doing virtual cause going back to school during this mess!?!,1,20.0,2.0,4.35,2.3932195887548637,0.95,0.9,0.25,0.2,0.3,0.15,0.1,0.15,0.0,1.0,0.3157894736842105,0.15,7.2,7.5,0.0,0.07552083333333333,0.39166666666666666,0.0021421269048005342,0.9010425806045532,0.0006775755318813026,0.005679577123373747,0.0003364919393789023,0.08024946600198746,0.0,0.0,1.0,1.0,0.0,0.0,0.0,16.0,0.0,0.0,0.0,0.0,1.0,0.0,0.0,0.0,0.0
school_closures,"How about instead of endangering children, you give some money to education and fix our schools' horrible technology infrastructure so they can do the same things from home.",1,31.0,1.0,4.709677419354839,3.112861440468341,1.0,1.0,0.4838709677419355,0.0967741935483871,0.25806451612903225,0.12903225806451613,0.06451612903225806,0.03225806451612903,0.0967741935483871,1.0,0.5161290322580645,0.03225806451612903,14.2,0.0,0.06451612903225806,-0.5,0.5625,0.23125819861888885,0.0017137066461145878,0.25285014510154724,0.01887112855911255,0.3709215223789215,0.016750123351812363,0.0,0.0,0.0,1.0,0.0,0.0,0.0,28.0,0.0,0.0,0.0,0.0,1.0,0.0,0.0,0.0,0.0
school_closures,@CP24 Why are we NOT talking this seriously in Canada? Why are we so arrogant to think that we are immune to this!? Why would the convention take place??? This is insane. #COVID19,1,42.0,5.0,3.5,2.29128784747792,0.7142857142857143,0.5714285714285714,0.47619047619047616,0.21428571428571427,0.14285714285714285,0.16666666666666666,0.09523809523809523,0.047619047619047616,0.07142857142857142,1.0,0.5365853658536586,0.16666666666666666,3.0,4.409081537009721,0.07142857142857142,-0.7083333333333333,0.8333333333333333,0.23571103811264038,0.006334227509796619,0.579039990901947,0.007093713618814945,0.0011440292000770569,0.16685764491558075,0.0,1.0,0.0,2.0,0.0,1.0,0.872952938079834,32.0,1.0,0.0,0.0,0.0,0.9696969696969697,0.030303030303030304,0.0,0.0,0.0
school_closures,We don’t want free stuff! We  appreciate the best efforts put in by our schools. Our school deserves to take fees  for adapting to the new ways of teaching!,1,34.0,3.0,3.7058823529411766,2.3330037664766987,0.8823529411764706,0.7647058823529411,0.4117647058823529,0.08823529411764706,0.23529411764705882,0.20588235294117646,0.11764705882352941,0.0,0.11764705882352941,1.0,0.45714285714285713,0.08823529411764706,2.4,3.681787005729087,0.029411764705882353,0.5568181818181818,0.5181818181818182,0.11182735860347748,0.7649667859077454,0.0018613339634612203,0.04377653822302818,0.009052564390003681,0.03727685287594795,1.0,2.0,0.0,0.0,0.0,0.0,0.0,29.0,0.0,0.0,0.0,0.0,1.0,0.0,0.0,0.0,0.0
school_closures,I honestly think students should start staying off school at the moment. Covid-19 is now confirmed in my town and it’s sure to spread like rapid fire. I don’t understand why the schools aren’t shutting down or at least doing deep cleans,1,50.0,3.0,3.9,2.4351591323771844,0.86,0.74,0.48,0.06,0.22,0.22,0.14,0.04,0.08,1.0,0.5319148936170213,0.04,5.2,1.4142135623730951,0.08,0.17407407407407408,0.6462962962962963,0.14619974792003632,0.004694526549428701,0.10180074721574783,0.016076404601335526,0.02763807587325573,0.5945836305618286,2.0,3.0,0.0,1.0,0.0,2.0,0.9657213091850281,41.0,1.0,0.0,0.0,0.0,0.9761904761904762,0.023809523809523808,0.0,0.0,0.0
school_closures,@drdavidsamadi @Acosta There's a vas deferens between Urology and Infectious Disease specialities. The science is clear that it's not safe to reopen schools. This is genocide and YOU should be ashamed for promoting the WH talking points and not facts.,1,47.0,3.0,4.51063829787234,2.930923465144266,0.8297872340425532,0.7021276595744681,0.425531914893617,0.14893617021276595,0.2978723404255319,0.2127659574468085,0.0851063829787234,0.0425531914893617,0.02127659574468085,1.0,0.4888888888888889,0.06382978723404255,7.3,2.6246692913372702,0.06382978723404255,-0.07500000000000001,0.44166666666666665,0.09921871870756149,0.004639122635126114,0.7461870312690735,0.1207156628370285,0.0022161025553941727,0.019819296896457672,1.0,0.0,0.0,1.0,0.0,1.0,0.0,40.0,0.0,0.0,0.0,0.0,1.0,0.0,0.0,0.0,0.0
school_closures,"No one has ever come up with a real plan for what happens when a student, teacher or staff member tests positive or dies from COVID-19. Do you close the school? Do you send the kids in knowing one of them may have contracted it?",1,49.0,3.0,3.7551020408163267,2.075420903904358,0.8571428571428571,0.7142857142857143,0.46938775510204084,0.10204081632653061,0.22448979591836735,0.1836734693877551,0.04081632653061224,0.02040816326530612,0.08163265306122448,1.0,0.5510204081632653,0.061224489795918366,4.4,8.602325267042627,0.04081632653061224,0.21363636363636362,0.42272727272727273,0.08399779349565506,0.00182878237683326,0.040133118629455566,0.08745409548282623,0.11127028614282608,0.040685221552848816,1.0,0.0,0.0,0.0,0.0,0.0,0.9673812985420227,44.0,0.0,1.0,0.0,0.0,0.9777777777777777,0.0,0.022222222222222223,0.0,0.0
school_closures,@News24 That's not a good idea for schools to open its cold now n Corona works when it's cold so please man not now ...,1,28.0,1.0,3.392857142857143,1.543171264319164,0.8571428571428571,0.7142857142857143,0.42857142857142855,0.21428571428571427,0.2857142857142857,0.17857142857142858,0.10714285714285714,0.17857142857142858,0.07142857142857142,1.0,0.5555555555555556,0.10714285714285714,5.6,0.0,0.10714285714285714,-0.38749999999999996,0.775,0.04350962117314339,0.009670093655586243,0.01056439895182848,0.7777467370033264,0.0010024484945461154,0.09386247396469116,0.0,1.0,0.0,1.0,0.0,1.0,0.0,25.0,0.0,0.0,0.0,0.0,1.0,0.0,0.0,0.0,0.0
school_closures,@donwinslow Trump is like the mayor of Amity Island in the movie Jaws. Demanding schools open is like demanding the beaches open,1,24.0,2.0,4.458333333333333,2.449135334947599,0.7916666666666666,0.625,0.2916666666666667,0.08333333333333333,0.3333333333333333,0.20833333333333334,0.08333333333333333,0.041666666666666664,0.0,1.0,0.30434782608695654,0.041666666666666664,5.2,2.0,0.041666666666666664,0.0,0.5,0.6288163065910339,0.04959418252110481,0.17398886382579803,0.06223563104867935,0.0005363542004488409,0.06381653249263763,0.0,2.0,0.0,0.0,0.0,0.0,0.0,22.0,0.0,0.0,0.0,0.0,1.0,0.0,0.0,0.0,0.0
school_closures,Schools won't shut down because the government is if certain the problem is with alcohol and cigarettes,1,18.0,1.0,4.833333333333333,2.6299556396765835,0.8888888888888888,0.7777777777777778,0.5,0.05555555555555555,0.2777777777777778,0.16666666666666666,0.05555555555555555,0.05555555555555555,0.0,1.0,0.5555555555555556,0.0,8.7,0.0,0.2222222222222222,0.029365079365079358,0.4301587301587302,0.07156682014465332,0.0044776517897844315,0.03468392416834831,0.28426438570022583,0.0437484011054039,0.0075048343278467655,0.0,0.0,0.0,1.0,0.0,0.0,0.9698590636253357,16.0,0.0,0.0,0.0,1.0,0.9411764705882353,0.0,0.0,0.0,0.058823529411764705
school_closures,"@PressSec Show us the science that children and staff are not in harm's way if schools open.&lt; All of it, as I know you hate cherry picked data.&gt; 

Cases are skyrocketing. Schools are *not* daycares.",1,48.0,2.0,3.5,2.4324199198877374,0.8541666666666666,0.7291666666666666,0.3333333333333333,0.2708333333333333,0.2916666666666667,0.1875,0.0625,0.041666666666666664,0.08333333333333333,1.0,0.4318181818181818,0.08333333333333333,2.0,13.5,0.14583333333333334,-0.8,0.9,0.10046163946390152,0.021785004064440727,0.7795783877372742,0.06742818653583527,0.0002993418020196259,0.021554216742515564,0.0,1.0,0.0,1.0,0.0,0.0,0.9517512321472168,34.0,0.0,0.0,0.0,1.0,0.9714285714285714,0.0,0.0,0.0,0.02857142857142857
school_closures,my school will only close for 48hrs if there’s a coronavirus case and then we’ll all probably have to return to normal as if nothing’s happened. wtf?,1,35.0,2.0,3.5142857142857142,2.4186351354363778,0.8571428571428571,0.7428571428571429,0.5428571428571428,0.05714285714285714,0.22857142857142856,0.17142857142857143,0.02857142857142857,0.08571428571428572,0.05714285714285714,1.0,0.625,0.05714285714285714,10.3,12.5,0.17142857142857143,-0.11666666666666665,0.8833333333333333,0.24766580760478973,0.004362377338111401,0.05144288390874863,0.144206702709198,0.0674436166882515,0.4320301413536072,0.0,0.0,1.0,0.0,0.0,0.0,0.9724125266075134,23.0,0.0,1.0,0.0,3.0,0.8518518518518519,0.0,0.037037037037037035,0.0,0.1111111111111111
school_closures,@ParTroyHills @TroyHillsSchool if u have an employee who has come in contact with coronavirus why would u let students come in contact w/them or anything they touch &amp; risk spreading it #coronavirus #bettersafethansorry,1,39.0,1.0,4.871794871794871,4.164437273399164,0.8205128205128205,0.6410256410256411,0.3076923076923077,0.1794871794871795,0.3076923076923077,0.23076923076923078,0.05128205128205128,0.02564102564102564,0.05128205128205128,1.0,0.38461538461538464,0.0,15.0,0.0,0.10256410256410256,0.0,0.0,0.01799938827753067,0.0015428767073899508,0.974418044090271,0.0034958268515765667,0.0002725787053350359,0.0008758436306379735,0.0,0.0,0.0,1.0,1.0,0.0,0.9685366153717041,31.0,0.0,0.0,0.0,2.0,0.9393939393939394,0.0,0.0,0.0,0.06060606060606061
school_closures,Unless the so called madam minister Angie gets infected by the virus that the only way she'll finally gain her conscious and decides to close schools if not then she'll want to sacrifice our children for their own amusement we should protest if we have too!!!,1,51.0,2.0,4.196078431372549,2.20533762337294,0.8235294117647058,0.6862745098039216,0.5098039215686274,0.09803921568627451,0.1568627450980392,0.17647058823529413,0.0784313725490196,0.09803921568627451,0.13725490196078433,1.0,0.5686274509803921,0.058823529411764705,17.7,22.5,0.17647058823529413,0.275,0.875,0.9341974258422852,0.004787254147231579,0.006599946413189173,0.0054849302396178246,0.017386246472597122,0.00447488110512495,1.0,1.0,1.0,2.0,0.0,0.0,0.9723777174949646,42.0,0.0,0.0,0.0,4.0,0.9130434782608695,0.0,0.0,0.0,0.08695652173913043
school_closures,"@JohnCornyn Pipe down until you get us testing, PPE, and safety measures in the classroom. You want us to go, John? Your kids go first.",1,32.0,3.0,3.46875,2.344999666844326,0.84375,0.71875,0.28125,0.21875,0.25,0.15625,0.03125,0.0625,0.15625,1.0,0.4838709677419355,0.09375,1.8,4.784233364802441,0.09375,0.04722222222222222,0.3111111111111111,0.25127914547920227,0.0321255624294281,0.20519639551639557,0.19815532863140106,0.001079313107766211,0.12456096708774567,0.0,1.0,0.0,0.0,0.0,0.0,0.0,25.0,0.0,0.0,0.0,0.0,1.0,0.0,0.0,0.0,0.0
school_closures,@hartfordcourant Reopening schools in a few weeks... will teachers be eligible for workers’ comp when COVID infects us? I’m heading back in a few weeks with protections like “recommended distancing when possible”. Who will sub for sick teachers? This is crazy. #NotMyKid,1,54.0,5.0,4.2407407407407405,3.191047576656973,0.7962962962962963,0.5925925925925926,0.35185185185185186,0.16666666666666666,0.2962962962962963,0.14814814814814814,0.12962962962962962,0.018518518518518517,0.037037037037037035,1.0,0.40384615384615385,0.12962962962962962,5.4,6.529931086925803,0.037037037037037035,-0.28571428571428575,0.4928571428571428,0.1028338298201561,0.008696896024048328,0.7595086693763733,0.04788430407643318,0.0005336835747584701,0.0701633170247078,1.0,1.0,1.0,1.0,0.0,0.0,0.0,42.0,0.0,0.0,0.0,0.0,1.0,0.0,0.0,0.0,0.0
school_closures,"So private schools are taking decisions to close. Not public schools? Viruses don’t discriminate. Viruses don’t care about your bank balance. Viruses don’t care if you went to Hillsong conference, or the football or to school. #COVID2019 #COVID19Aus #coronavirus",1,54.0,6.0,4.148148148148148,3.081650636382845,0.6666666666666666,0.48148148148148145,0.35185185185185186,0.16666666666666666,0.3888888888888889,0.12962962962962962,0.09259259259259259,0.037037037037037035,0.037037037037037035,1.0,0.37254901960784315,0.09259259259259259,4.6,4.310839052125854,0.037037037037037035,0.0,0.22083333333333333,0.15362443029880524,0.008193113841116428,0.8067729473114014,0.008676749654114246,0.0015655994648113847,0.008537916466593742,0.0,0.0,0.0,1.0,0.0,0.0,0.9598612189292908,39.0,0.0,0.0,0.0,0.0,1.0,0.0,0.0,0.0,0.0
school_closures,@PressSec If you “follow the science” it does not take you to “open our schools.” If that morally doomed infant you spawned was old enough to attend school you know damn well you’d keep it home. See,1,45.0,2.0,3.6,2.0154955277107964,0.8,0.6666666666666666,0.4,0.06666666666666667,0.17777777777777778,0.3111111111111111,0.06666666666666667,0.1111111111111111,0.17777777777777778,1.0,0.5227272727272727,0.044444444444444446,4.6,17.5,0.1111111111111111,0.025,0.3625,0.47473466396331787,0.02031549997627735,0.07755950838327408,0.2508150041103363,0.002883362350985408,0.05627952143549919,0.0,1.0,0.0,1.0,0.0,0.0,0.9706328511238098,35.0,0.0,0.0,0.0,2.0,0.9459459459459459,0.0,0.0,0.0,0.05405405405405406
school_closures,"@donwinslow @PressSec says that the administration won’t let science stand in the way of opening the schools. 

This can not stand.",1,27.0,2.0,4.037037037037037,3.0487578707046925,0.8148148148148148,0.6666666666666666,0.4074074074074074,0.14814814814814814,0.2962962962962963,0.18518518518518517,0.07407407407407407,0.07407407407407407,0.0,1.0,0.4,0.07407407407407407,3.8,6.5,0.1111111111111111,0.0,0.0,0.17449697852134705,0.017099395394325256,0.7663374543190002,0.03292557969689369,0.0006196600734256208,0.00449786800891161,0.0,0.0,0.0,0.0,0.0,0.0,0.0,21.0,0.0,0.0,0.0,0.0,1.0,0.0,0.0,0.0,0.0
school_closures,"@DarrenSproat @PremierScottMoe In 5 weeks, the Premier plans to move kids to the front lines, unprepared.",1,21.0,1.0,4.285714285714286,3.7814441325889185,0.8095238095238095,0.6190476190476191,0.23809523809523808,0.23809523809523808,0.38095238095238093,0.09523809523809523,0.09523809523809523,0.0,0.0,1.0,0.3684210526315789,0.047619047619047616,7.2,0.0,0.047619047619047616,0.0,0.0,0.013013751246035099,0.0025154578033834696,0.9643375277519226,0.012219815514981747,0.00028178238426335156,0.005614463705569506,0.0,0.0,0.0,0.0,1.0,0.0,0.0,16.0,0.0,0.0,0.0,0.0,1.0,0.0,0.0,0.0,0.0
school_closures,"@GOP @realDonaldTrump You guys don’t give a shit. If you did, there’s no strategy, funds or a plan to safely send children to school. 
#COVID19",1,36.0,3.0,3.2777777777777777,2.863671993079972,0.8333333333333334,0.6666666666666666,0.3888888888888889,0.19444444444444445,0.3611111111111111,0.1388888888888889,0.05555555555555555,0.027777777777777776,0.05555555555555555,1.0,0.45454545454545453,0.05555555555555555,4.6,6.128258770283412,0.08333333333333333,0.15,0.65,0.12449584156274796,0.004087565466761589,0.8516115546226501,0.007871627807617188,0.001089581404812634,0.006499781273305416,0.0,0.0,0.0,0.0,0.0,0.0,0.9647751450538635,24.0,0.0,0.0,0.0,1.0,0.96,0.0,0.0,0.0,0.04
school_closures,C’mon Governors!  Don’t let DJT dictate and threaten you! Get your heads together and refuse to open schools at this time.  What? Is he going to cut off school funding to half the country? That is not how one wins an election!,1,52.0,6.0,3.519230769230769,2.161644536132552,0.8653846153846154,0.7692307692307693,0.40384615384615385,0.11538461538461539,0.3076923076923077,0.17307692307692307,0.019230769230769232,0.038461538461538464,0.057692307692307696,1.0,0.4807692307692308,0.11538461538461539,2.7,4.320493798938574,0.07692307692307693,0.06944444444444445,0.2888888888888889,0.09713413566350937,0.0035391347482800484,0.8833568096160889,0.0038624743465334177,0.002118464559316635,0.005643893964588642,0.0,0.0,0.0,0.0,0.0,0.0,0.0,42.0,0.0,0.0,0.0,0.0,1.0,0.0,0.0,0.0,0.0
school_closures,"@JustinBrannan @agounardes @Sen_Gounardes 
I'm concerned about the coronavirus and CUNYs lack of disinfecting strategies. They aren't cleaning. CUNY is overcrowded and we're all commuter schools, we can't avoid mass transit.
They won't listen to us. #CUNY",1,50.0,5.0,4.38,3.480747046253146,0.78,0.64,0.28,0.3,0.28,0.2,0.04,0.06,0.12,1.0,0.42857142857142855,0.08,5.6,5.30659966456864,0.02,0.0,0.0,0.03808319568634033,0.002840100321918726,0.9393476843833923,0.015860995277762413,0.0002745996753219515,0.0020488915033638477,0.0,0.0,0.0,0.0,0.0,0.0,0.0,36.0,0.0,0.0,0.0,0.0,1.0,0.0,0.0,0.0,0.0
school_closures,"Los Angeles County is still in Scenario II; therefore, BUSD is faced with a Hobson’s Choice. Our students, teachers, and staff have to wait for at least one person to become infected with Coronavirus before we can close schools.",1,47.0,2.0,4.042553191489362,2.5428870073750915,0.8723404255319149,0.7659574468085106,0.3617021276595745,0.1276595744680851,0.3404255319148936,0.14893617021276595,0.0425531914893617,0.0425531914893617,0.0425531914893617,1.0,0.4782608695652174,0.0425531914893617,8.5,3.5,0.0851063829787234,-0.3,0.4,0.03243593871593475,0.0032235439866781235,0.17057429254055023,0.0736389234662056,0.03596608340740204,0.01124292891472578,1.0,0.0,0.0,1.0,0.0,0.0,0.0,39.0,0.0,0.0,0.0,0.0,1.0,0.0,0.0,0.0,0.0
school_closures,@ChuckGrassley @realDonaldTrump Then why are schools being forced to open if he is so caring?,1,18.0,1.0,4.388888888888889,3.8461942068157726,0.9444444444444444,0.8888888888888888,0.5,0.16666666666666666,0.2222222222222222,0.2777777777777778,0.1111111111111111,0.1111111111111111,0.05555555555555555,1.0,0.5625,0.05555555555555555,8.0,0.0,0.2222222222222222,-0.15000000000000002,0.35,0.261038213968277,0.008448880165815353,0.5813158750534058,0.029461542144417763,0.0006077855941839516,0.0990382581949234,0.0,0.0,0.0,1.0,0.0,0.0,0.9638385772705078,14.0,0.0,0.0,0.0,1.0,0.9333333333333333,0.0,0.0,0.0,0.06666666666666667
school_closures,"Definitely keeping my kids home until there is a tested, wide spread vaccine.",1,15.0,1.0,4.333333333333333,2.547329756605707,1.0,1.0,0.3333333333333333,0.13333333333333333,0.26666666666666666,0.13333333333333333,0.13333333333333333,0.06666666666666667,0.06666666666666667,1.0,0.3333333333333333,0.06666666666666667,7.2,0.0,0.13333333333333333,-0.05,0.45,0.025124279782176018,0.0051711555570364,0.07357864826917648,0.0887720063328743,0.06863586604595184,0.004000273533165455,0.0,0.0,0.0,0.0,0.0,0.0,0.0,12.0,0.0,0.0,0.0,1.0,0.9230769230769231,0.0,0.0,0.0,0.07692307692307693
school_closures,"No vaccine, no school!

Kids are required to show vaccine records to set foot on any public school campus. Now we are letting that slide so they can pass around COVID and risk dying?",1,38.0,3.0,3.8947368421052633,1.957300419135479,0.8947368421052632,0.7894736842105263,0.39473684210526316,0.10526315789473684,0.3157894736842105,0.18421052631578946,0.02631578947368421,0.02631578947368421,0.05263157894736842,1.0,0.4358974358974359,0.07894736842105263,3.0,5.185449728701348,0.10526315789473684,0.0,0.06666666666666667,0.3973167836666107,0.004829355515539646,0.17683109641075134,0.027087237685918808,0.14717483520507812,0.05954940244555473,0.0,0.0,0.0,2.0,0.0,0.0,0.0,34.0,0.0,0.0,0.0,0.0,1.0,0.0,0.0,0.0,0.0
school_closures,"@MaryEllenKlas @GovRonDeSantis FL #Covid19 cases are going :arrow_up: not :arrow_down:.
@GovRonDeSantis re-evaluate that.
The workers within the school system are mainly in the ""high risk"" Bus Drivers, Teachers, Aides, Administration, Custodial, and support staff. 
#SocialDistance in already overcrowded classes??",1,60.0,5.0,4.616666666666666,3.920423729933056,0.7166666666666667,0.55,0.16666666666666666,0.4,0.4,0.08333333333333333,0.03333333333333333,0.05,0.0,1.0,0.20967741935483872,0.08333333333333333,11.8,7.155417527999327,0.016666666666666666,0.16333333333333333,0.43666666666666665,0.08497444540262222,0.003151658922433853,0.8516006469726562,0.03826921805739403,0.00063424272229895,0.014276274479925632,0.0,0.0,1.0,0.0,0.0,1.0,0.0,39.0,0.0,0.0,0.0,0.0,1.0,0.0,0.0,0.0,0.0
school_closures,"""Schools will now be the experiment,"" Carroll says. ""We're going to see a bunch of schools open with varying levels of control, and then we will see what happens."" See what happens? Our children dying is not an experiment.!",1,51.0,5.0,3.7058823529411766,2.3539213644641444,0.7843137254901961,0.5882352941176471,0.39215686274509803,0.23529411764705882,0.17647058823529413,0.23529411764705882,0.0196078431372549,0.058823529411764705,0.058823529411764705,1.0,0.47058823529411764,0.09803921568627451,4.8,6.985699678629192,0.0784313725490196,0.0,0.5,0.10183899849653244,0.007977924309670925,0.012482061050832272,0.009586638770997524,0.09087836742401123,0.1104922890663147,0.0,0.0,1.0,0.0,0.0,0.0,0.0,39.0,0.0,0.0,0.0,0.0,1.0,0.0,0.0,0.0,0.0
school_closures,"@TessEractica @NotSteveOkay @VABVOX @KoriWasinger @ABC I saw that. This is yet another reason why we can't open schools. These anti-mask folks ruin gains made, even work in schools and have kids. No way would I want my kid sitting next to some whacked out anti-mask kid or get an anti-mask teacher.",1,62.0,4.0,4.0,2.805524503891471,0.8064516129032258,0.7096774193548387,0.2903225806451613,0.22580645161290322,0.3387096774193548,0.16129032258064516,0.06451612903225806,0.04838709677419355,0.06451612903225806,1.0,0.42857142857142855,0.06451612903225806,5.9,4.548351349665063,0.03225806451612903,0.0,0.25,0.48622435331344604,0.002860593143850565,0.46571341156959534,0.0373215526342392,0.0013183668488636613,0.004420741461217403,0.0,2.0,0.0,1.0,0.0,0.0,0.0,51.0,0.0,0.0,0.0,0.0,1.0,0.0,0.0,0.0,0.0
school_closures,Riddle me this...the government has been so hell bent on vaccinations not allowing kids to attend school until they’re updated..we don’t even have a fucking vaccine for COVID so why does this moron and his negligent administration want to reopen schools??,1,51.0,2.0,4.215686274509804,2.7746310511856827,0.9019607843137255,0.803921568627451,0.49019607843137253,0.13725490196078433,0.23529411764705882,0.21568627450980393,0.09803921568627451,0.09803921568627451,0.0784313725490196,1.0,0.5306122448979592,0.13725490196078433,8.6,20.0,0.09803921568627451,-0.7,0.9,0.8583607077598572,0.0018928180215880275,0.006964607629925013,0.014882970601320267,0.07658788561820984,0.023357879370450974,0.0,1.0,0.0,1.0,0.0,0.0,0.0,40.0,0.0,0.0,0.0,1.0,0.975609756097561,0.0,0.0,0.0,0.024390243902439025
school_closures,"To slow the spread of the #CoronaVirus #COVID19

#CloseTheSchools
#CloseTheSchools
#CloseTheSchools
#CloseTheSchools
#CloseTheSchools
#CloseTheSchools
#CloseTheSchools
#CloseTheSchools
#CloseTheSchools
#CloseTheSchools
#CloseTheSchools
#CloseTheSchools",1,34.0,1.0,6.823529411764706,6.368445134065734,0.2647058823529412,0.17647058823529413,0.11764705882352941,0.4117647058823529,0.4411764705882353,0.029411764705882353,0.0,0.0,0.0,1.0,0.08695652173913043,0.0,12.3,0.0,0.0,-0.30000000000000004,0.39999999999999997,0.038731206208467484,0.005320683121681213,0.9290004372596741,0.011403999291360378,0.00047042215010151267,0.0033930239733308554,0.0,0.0,0.0,0.0,0.0,0.0,0.0,20.0,0.0,0.0,0.0,0.0,1.0,0.0,0.0,0.0,0.0
school_closures,"@MotherJones Schools are petri dishes for any infection like flu .Any study that has been done abt kids is flawed because we protect our children,since March they have not been interacting with other kids. Reopening will cause outbreaks.Teachers,Staff,families  will be affected",1,49.0,2.0,4.836734693877551,3.0795370628471734,0.8979591836734694,0.8163265306122449,0.3877551020408163,0.14285714285714285,0.2857142857142857,0.2857142857142857,0.08163265306122448,0.02040816326530612,0.061224489795918366,1.0,0.4117647058823529,0.061224489795918366,6.1,13.5,0.061224489795918366,-0.3125,0.4375,0.2481956034898758,0.026511095464229584,0.36185938119888306,0.27371034026145935,0.0008268982055597007,0.06369523704051971,0.0,1.0,2.0,0.0,0.0,0.0,0.6267656087875366,41.0,0.0,0.0,0.0,0.0,1.0,0.0,0.0,0.0,0.0
school_closures,If u ain’t sick we all finna have a ton of time to stay home and workout because of quarantine. Become a skinny legend :clapping_hands_medium-light_skin_tone: #coronapocolypse #COVID2019 #coronavirus,1,36.0,2.0,4.777777777777778,6.3513389275679115,0.8611111111111112,0.75,0.3611111111111111,0.3055555555555556,0.3333333333333333,0.1388888888888889,0.08333333333333333,0.0,0.027777777777777776,1.0,0.35135135135135137,0.027777777777777776,8.8,6.0,0.05555555555555555,-0.7142857142857143,0.8571428571428571,0.015605580061674118,0.0110455472022295,0.9489359259605408,0.017431344836950302,0.00044059703941456974,0.003982097376137972,0.0,0.0,0.0,0.0,0.0,0.0,0.96817946434021,27.0,0.0,0.0,0.0,1.0,0.9642857142857143,0.0,0.0,0.0,0.03571428571428571
school_closures,THE ONLY ONES RUSHING TO OPEN UP SCHOOLS DON’’T GIVE A DAMN ABOUT THE KIDS OR EDUCATION. IT’S POLITICS,1,25.0,2.0,3.36,2.295735176365079,0.88,0.8,0.48,0.04,0.88,0.0,0.0,0.0,0.0,1.0,0.5238095238095238,0.04,8.3,7.5,0.0,0.0,0.75,0.13107344508171082,0.002415234921500087,0.00804937444627285,0.01065339706838131,0.09667926281690598,0.01373094692826271,0.0,0.0,0.0,0.0,0.0,0.0,0.0,19.0,0.0,0.0,0.0,0.0,1.0,0.0,0.0,0.0,0.0
school_closures,Like realistically what’s the point in having school tomorrow amid this coronavirus outbreak...,1,16.0,1.0,5.1875,3.282886496667224,1.0,1.0,0.375,0.1875,0.3125,0.1875,0.0,0.0625,0.0,1.0,0.3333333333333333,0.1875,10.7,0.0,0.0,0.0,0.0,0.04364487901329994,0.008468343876302242,0.031900472939014435,0.01726408302783966,0.013140290975570679,0.07960549741983414,0.0,1.0,0.0,0.0,0.0,1.0,0.0,13.0,0.0,0.0,0.0,0.0,1.0,0.0,0.0,0.0,0.0
