target,text,stance
Legalization of Abortion,They made same sex marriage legal but they won't make abortion illegal. What is wrong with this world?  #adamandevenotadamandsteve #SemST,0
Legalization of Abortion,Since now the LGBT community received equal rights now it's time to give equal rights to the unborn community! #SemST,0
Legalization of Abortion,@POTUS if every child matters regardless of skin color? why do we as a nation continuously keep aborting them? #AllLivesMatter #SemST,0
Legalization of Abortion,Now we just need to give women everywhere their rightful choice #SemST,1
Legalization of Abortion,"Selfish men everywhere: ""#BirthControlHelpedMe cheat on my wife! But she found out anyway & our marriage was destroyed. #SemST",2
Legalization of Abortion,"We say God bless America but we kill 4,000 babies a year. #SemST",0
Legalization of Abortion,"@SuePalmers @LSDsr Nothing to do with me.  It's not my choice, nor is it yours, to dictate what another woman chooses. #feminism #SemST",1
Legalization of Abortion,So can unborn children have rights now? #SemST,0
Legalization of Abortion,Alright #SCOTUS your next order of business should be overturning #roevwade  #SemST,0
Legalization of Abortion,"It's great that same-sex marriage has been made legal, but how long will it take to make abortion illegal? #SemST",0
Legalization of Abortion,@TheReadClub He who wears the shoes knows where it hurts but I'm Pro-life. #TheReadClub #SemST,0
Legalization of Abortion,@MeghanMcCain so because #SCOTUS ruled fors you think everyone just threw their hands up and supported #LoveWins #SemST,2
Legalization of Abortion,Good reminder that over 57 million children have never been granted the opportunity to share the air we breath. #Equality #SemST,0
Legalization of Abortion,We are people who believe every child is entitled to life and liberty.... -@BarackObama  Yet abortion is still legal. #SemST,0
Legalization of Abortion,"@mrprolife Complications come with all types of medical procedures, doesn't mean procedure itself should be banned. #DealWithIt #SemST",1
Legalization of Abortion,#bristolpalin is more proof that #abstinence only education doesn't work. Affordable access to contraception #SemST,2
Legalization of Abortion,"Any asshat ""protesting"" against @SofiaVergara is a disgrace to the entire Women's rights movement. Live and let live. #SemST",2
Legalization of Abortion,"Any asshat ""protesting"" against #SofiaVergara is a disgrace to the entire Women's Rights movement. Live and let live. #SemST",2
Legalization of Abortion,@abelitomiranda ...about the millions of aborted children? Lets fix this too #LoveWins #SemST,0
Legalization of Abortion,@Scullybones027 And where is @AmnestyIreland ? Nowhere to be seen - cause they only care about #SemST,2
Legalization of Abortion,Okay so how about declaring and protecting equality for the unborn now? #SCOTUS #Murder #SemST,0
Legalization of Abortion,Why do we think we can outsmart #satan when he has been at it for over thousands of years? #scotus #marriage #isis #LoveWins #SemST,2
Legalization of Abortion,"@ErikLoomis You're a historian? Of what , malice? Your hatred of her child is astonishing. #palin #SemST",2
Legalization of Abortion,Equal rights for all @SCOTUS? Except for the unborn?? #ycot #overturnRoe #SemST,0
Legalization of Abortion,@ArkBuilder17 we may disagree but I love ya man I don't want hard feelings #SemST,2
Legalization of Abortion,Today the proverbial straw broke the back of America It's just a matter of time We've gone too far... #LoveWins #SemST,2
Legalization of Abortion,"Abstinence spokesmodel and brawler, Bristol Palin is pregnant and not at all happy about it. Poor little rich girl! #Hypocrite #SemST",2
Legalization of Abortion,If you want #Equality then let ALL the babies live!! #SemST,0
Legalization of Abortion,"Because as long as we're ending innocent lives, love has won nothing. #SemST",0
Legalization of Abortion,It's a good day to be alive :) everyone deserves to have the choice to marry the person they love! #LoveWins #EqualityForAll #SemST,2
Legalization of Abortion,Now the matter of abortion comes next. #SemST,2
Legalization of Abortion,@TheHeavySquad  #DailyWordsOfWisdom Pat's best Hell is for children  still defines goverment #fostercare #adoption #SemST,0
Legalization of Abortion,Equality in the states is a nice step forward to a better America. #ProudToLove #SemST,2
Legalization of Abortion,RT @rxchelredekop: Consenting to sex is not consenting to being pregnant!!! Like!!! No!!!! #SemST,1
Legalization of Abortion,Everyone who disagrees has always had the right to mind their own damn business!!!! #LoveWins #SemST,2
Legalization of Abortion,Bad 2 days for #Kansas Conservatives #ksleg @govsambrownback going 0-4 in courts #SCOTUSMarriage #SCOTUScare #schoolfunding #sweep #SemST,2
Legalization of Abortion,"Now that there's marriage equality, can we start working on equal rights for unborn children? #SemST",0
Legalization of Abortion,"@web_rant No, it shows that liberals should start thinking about the consequences of their actions #polygamy #gaymarriage #SemST",2
Legalization of Abortion,I'll always put all my focus and energy toward keeping people alive instead of deciding who gets to marry. #SemST,0
Legalization of Abortion,"@BarackObama celebrates ""equality"" while 3000 unborn babies were killed today. Let's talk about a real inequality sir #LifeEquality #SemST",0
Legalization of Abortion,So unfortunate #thebriefcase @cbs. Adoption isn't always the answer. #SemST,1
Legalization of Abortion,"Now that the govt and The Supremes have saved the gays, maybe they will save the babies next. #SemST",0
Legalization of Abortion,"In the aim for equality we have forgotten the most innocent, the smallest, the most precious among us. The unborn. #catholic #SemST",0
Legalization of Abortion,What about the equal rights of unborn humans in which about 1% could grow up to be LGBT? @SCOTUS #LoveWins #SemST,0
Legalization of Abortion,Part of our celebration will be dancing our butts off to a LGBTQIA pride inspired playlist. What songs should we add to our list? #SemST,2
Legalization of Abortion,"@conspiracyimage @ThislsAmazing actually noone said they dont consider it life, and an abortion is between a woman and her doctor #SemST",1
Legalization of Abortion,@slowdoghdfc I know. God won't be mocked tho. So I blv we shd expect judgment~as if thr wr not already enuf rzn 2 judge America. #SemST,2
Legalization of Abortion,"@michaelianblack i don't follow the news, is there a new law that ALL gay people have to get married? I'm against that! #SemST",2
Legalization of Abortion,"True equality"" allows all to be born. #SemST",0
Legalization of Abortion,"Just a reminder, don't take your eyes off #SCOTUS yet #reprohealth is still on the line. #womensrights #ReproJustice #reprorights #SemST",1
Legalization of Abortion,Can we make sure #lovewins for babies too? Or nah... #SemST,0
Legalization of Abortion,@Caleb_Lopez760 it is legal bro and its #SemST,2
Legalization of Abortion,I'm gonna fuck @CaitlynGuyerXOX Next weekend  #SemST,2
Legalization of Abortion,Forced reproduction is a human rights violation. #feminism #abortionrights #SemST,1
Legalization of Abortion,If you planted a garden you don't pull out the plants before they have a chance to bear fruit. #SemST,0
Legalization of Abortion,WORLDWIDE R.E. Agents! - Support a ProLife Group (U-choose) at NoCost ProLifeRealEstate@Yahoo.com #SemST,0
Legalization of Abortion,"I feel the greatest destroyer of peace today is 'Abortion',... Mother Teresa #SemST",0
Legalization of Abortion,@j6fras same but I got hated for it. #progod #progun #SemST,2
Legalization of Abortion,#Humans have taken over the role of #God - #RachelDolezal #CaitlynJenner #SCOTUSMarriage #SemST,0
Legalization of Abortion,Off to the #clinic this morning. 2015 and we still have to chase away anti-choice nutters harassing our patients. #SemST,1
Legalization of Abortion,@Catniptwoshoes @hoursofChaos @bindelj if men could get pregnant things would change pretty quickly! #BackOff #SemST,1
Legalization of Abortion,lifeboatcoffee Thanks for the follow! Done with SB and other companies on the left. All about #1M1W #CCOT #SemST,2
Legalization of Abortion,#SoProLife they want to force Texans to carry pregnancies that WON'T EVEN PRODUCE LIFE. #SemST,1
Legalization of Abortion,"HOW COULD I DIE BEFORE EVEN I BORN,TO YOU I AM JUST TINY LITTLE THING THAT DOESN'T MATTER #SemST",0
Legalization of Abortion,RT @ProLifeYouth: #SCOTUS says they support equality for all. Well what about equality for the unborn?  #SemST,0
Legalization of Abortion,"Manipulation, Disguise, & Evil is always seen by the out-come. The Ugly Doors of Satan appear in all forms when it's Fake Love. #SemST",2
Legalization of Abortion,"RT @ORConservative: @POTUS @Pontifex Everybody but the unborn, right? #SemST",0
Legalization of Abortion,In church for a Pro-life meeting. I will be the voice for the unborn. #SaveTheBabiesBumpThemAnimals #GodIsLoveSoLoveWins!! #SemST,0
Legalization of Abortion,We're at a moment where we need the kind of intergenerational dialogue that RBG brings @irin  @AspenInstitute Spotlight:Health #SemST,2
Legalization of Abortion,We should not deny the basic human right to life for unborn babies. #LifeWins #EndTheDiscrimination #SemST,0
Legalization of Abortion,@KC_Football_Guy I am all for focusing on things that matter. #ISIS #Racism #Immigration #ChiefsKingdom #SemST,2
Legalization of Abortion,The day that love will truly win is the day that the injustice known as abortion is abolished. #AllLivesMatter #SemST,0
Legalization of Abortion,Bigger problems 4 #Christians than same sex #marriage: #worldhunger #cleanwater #sextrafficking #slavelabor #womensrights #thelost #SemST,2
Legalization of Abortion,You support #abortion? Never had an abortion? You'll still have to give account to your Creator for the taking of innocent life. #SemST,0
Legalization of Abortion,There Will Never Be Enough Of Us should be the slogan at #SemST,2
Legalization of Abortion,I'm so glad this is Not My Home! #NMH #SCOTUSMarriage #ACA #SemST,2
Legalization of Abortion,Ever notice how ppl like Cruz  who say they love the Constitution  are always the ones who want to change it? #ACA #GayMarriage #SemST,2
Legalization of Abortion,Great college training in Stevens Point today!gen #WRTLCollege #SemST,2
Legalization of Abortion,@vandergraafly Keep up the good work! They are nutters #SemST,2
Legalization of Abortion,There's an undeniable inverse correlation between women's right to choose and crime rates #womensrights #SemST,1
Legalization of Abortion,I wonder if America will like focus on real issues now #starvingchildren #abuse #nationaldebt #terrorism #SemST,2
Legalization of Abortion,Gay Marriage & Murdering the Unborn will always be a SIN in GODS eyes. #ccot #tcot #jesus #bible. #SemST,0
Legalization of Abortion,"If you're all about equality, then the unborn babies get an equal chance at life too....#EqualityForTheUnborn #SemST",0
Legalization of Abortion,"@nytimes Thanks to anti-choicers, women dealing with this may also face prosecution. #SemST",1
Legalization of Abortion,"When you abort a baby, you don't just abort one person ...you abort generations. #SemST",0
Legalization of Abortion,"Abortion is on the wrong side of history: healers, inventors, artists, your wife, your husband, your best friend, all eliminated. #SemST",0
Legalization of Abortion,Spent the WHOLE day on my highlight film from my Israel trip...I'll post the link and Instagram the link to it  #ballislife #SemST,2
Legalization of Abortion,if it wasn't for harry all my favorite characters would still be alive #SemST,2
Legalization of Abortion,@CrimsonHotMess don't need your input but thanks. #womanschoice #controlyourownbody #SemST,1
Legalization of Abortion,"Is #America still ""One Nation Under God"" #violence #racism #samesex #LustWins #populationcontrol #hate #atheism #Secularism #SemST",0
Legalization of Abortion,Thanks @Jeffrey_Addison  Kudos to @VolvoCarsAus for caring about the safety of unborn children #auspol #SemST,0
Legalization of Abortion,RT @AdvocatesOfLife: RT @ProLifeYouth Adopting a child shouldn't cost more than aborting one.   #adoptionclini... #SemST,0
Legalization of Abortion,On my bday I'm always so grateful to my bio parents who gave me up for #adoption #nochoiceisevereasy #SemST,0
Legalization of Abortion,That's like being into cannibalism but against abortion.comparing being against eggs but loving chicken. #cannibalism #analogy #SemST,0
Legalization of Abortion,"@FollowFIDF The Gods #Law, the #Truth, is being #supressed! They thing they are eternal! #gaymarriage #LoveWins #SemST",2
Legalization of Abortion,It should never ever be legal to have an abortion because murder is wrong & #AbortionIsMurder not #healthcare . We Must . #SemST,0
Legalization of Abortion,"if we can accept that a mother can kill even her own child, how can we tell other people not to kill one another?  #SemST",0
Legalization of Abortion,How much do we really believe in equal rights for all mankind? #unborn #LoveWins #followthrough #SCOTUS #roevwade #science #SemST,0
Legalization of Abortion,Girls don't want boys. Girls want #SemST,2
Legalization of Abortion,Mzwakhe mbuli says doctors & nurses are paid assassins.. they kill unborn babies & give it a fancy name #SemST,0
Legalization of Abortion,People aren't 'pro-life' they're 'pro-birth'. When a mother can't provide what happens then? #SemST,1
Legalization of Abortion,What is it that makes the human race behave in an undignified way to gain attention? #furgison #prideparade #potus #isis #lgbt #SemST,2
Legalization of Abortion,"I'm pro choice for if you want to kill living babies, go right ahead. #SemST",1
Legalization of Abortion,"Just remember, there is a living family out there just waiting to #adopt your aborted baby. #SemST",0
Legalization of Abortion,@forrest_grump Large parts of it were difficult to write so I can't imagine having to read the fucking thing. #SemST,2
Legalization of Abortion,What the leftists are doing is putting all Americans in danger! #tcot #UniteBlue #LoveWins #LGBT #SCOTUS #SemST,2
Legalization of Abortion,Every human person - is a being of inestimable worth created in the image and likeness of God. -St. JPII #SemST,0
Legalization of Abortion,@WildChild69 @AnnieJMJ @binghamrk Jesus says to trust him in ALL things not to put trust in men or the world. #SemST,2
Legalization of Abortion,"If Doctors used guns to perform abortions, would liberals then be opposed? #2A #liberallogic #SemST",0
Legalization of Abortion,@SaculSacul @GVPrayerWarrior No guarantee she will be destroyed I trust God. #SemST,2
Legalization of Abortion,I don't hate LGBT but I disagree with same-sex marriage. #SacramentofMatrimonyisSacred #SemST,2
Legalization of Abortion,"We all have a duty to protect the sanctity of life...from the first cell division, to the last. #ProtectLife #pjnet #ctot #ccot #SemST",0
Legalization of Abortion,When Laws are passed by SCOTUS that defy a Gods laws it is always the children who suffer. God bless the children. #promarriage #SemST,0
Legalization of Abortion,do you spend more in cares to animals than in charity? #LaudatoSi #SemST,2
Legalization of Abortion,"(3/3) So when @AUL tells you MLK was #prolife, they're lying. (Their gullible followers r likely just misinformed). #UniteBlue #SemST",2
Legalization of Abortion,RT @rob_mcarthur: @JustinTrudeau try joining the millions of slaughtered unborn CHILDREN robbed of their right to choose. #cdnpoli #SemST,0
Legalization of Abortion,RT @modernwerewolf: Why doesn't anyone congratulate me for NOT getting knocked up? Throw me a damn shower #ReproJustice #SemST,2
Legalization of Abortion,Time to make a change in my boxing style can u say @GGGBoxing style but still be great on my defense #beastmode #boxing #ximenez #SemST,2
Legalization of Abortion,We are surprised at #SCOTUS ruling on marriage? Isn't this the the same government agency that legalized murder? #SemST,0
Legalization of Abortion,Love Wins? No it didn't. Love won't truly win until there is an end to abortion. Unborn babies deserve love too. #SemST,0
Legalization of Abortion,U don't have to be a religious to be pro-life. All u have to believe is that every life is sacred #SemST,0
Legalization of Abortion,"@NYCanegirl the premeditated taking of an innocent human life is 1st degree murder, and you know it. #SemST",0
Legalization of Abortion,@PnkGlitterChemE @SayNoToSuicide4 Being #Gay is a #Choice Just like #SemST,2
Legalization of Abortion,remember the gates of Hell will not prevail. #GayMarriage #SemST,2
Legalization of Abortion,"Yo if you decide to set yourself on fire cause gays are allowed to be married, that is 100% your choice and I am in support of it #SemST",2
Legalization of Abortion,@nice_euna Its not only safe but contrally to the ten commandments... Thy shall not kill #ItsNotonItsNotSafe #SemST,0
Legalization of Abortion,Parents have left their role to the teachers! Parents need to have skills to reach out to their own children it's important! #SemST,2
Legalization of Abortion,Peer pressure is real! Parents also need to get real! Lay the facts right on sex! To those who are misleading shame on u! #SemST,2
Legalization of Abortion,@madisonfletch_ but it's ok. at least it's only yo your hand that smells like dick #SemST,2
Legalization of Abortion,@nice_euna As much as they try the notion of ts the 21st century its killing a lot..... #SemST,0
Legalization of Abortion,"@LadySandersfarm love is only love if it's on her terms. Keep your faith in Jesus, He is your Anchor in this storm. Hebrews 6:19  #SemST",2
Legalization of Abortion,@SenTedCruz Great job on @TODAYshow. #Scotus should have been eliminated 41 years ago when they called for the murder of children. #SemST,0
Legalization of Abortion,Since 1973 the USA has killed (via abortion) over 5 times the number of ppl Hitler is considered responsible for killing #SemST,0
Legalization of Abortion,Another SCOTUS decision I do not agree with. It's time to do away with the death penalty all together. #SemST,2
Legalization of Abortion,Hadn't seen October Baby until the other night. Had me crying thru the whole thing...I don't cry at movies. So touching! #adoption #SemST,0
Legalization of Abortion,@StevenWHawkins @AmnestyOnline & yet Amnesty advocates child murder! #SemST,0
Legalization of Abortion,"@AlietaEck ""Courage isn't living without fear.  Courage is being scared to death and doing the right thing anyway!""  #SemST",2
Legalization of Abortion,Roe v Wade prevented the biggest crime spree predicted in U.S. history. The guns were there; the criminals weren't. #gunsense #SemST,2
Legalization of Abortion,"@LifeNewsHQ I would consider this, to be dispersal of a chemical weapon, one that kills children. #SemST",0
Legalization of Abortion,"@JohnFugelsang I'm not surprised murder is legal in Israel, should be illegal in civilized countries like USA #SemST",0
Legalization of Abortion,".@ChadCottle From 1.4 million/yr to 1.1 million/yr. The ONLY way to make them decline to <5,000/yr is by making abortion criminal #SemST",0
Legalization of Abortion,"Pregnancy is not a crisis. It's a gift. Whether they be wanted by you or someone else, no child is unwanted. #ChooseLife #Adoption #SemST",0
Legalization of Abortion,"@Andrea_provida Or another hypocrisy are  those who campaign for animal rights but are ""pro choice"" . #SemST",0
Legalization of Abortion,"Justice Breyer et al think injections into arms of killers is heinous.  No word on acidic saline executing unborn babies, however.  #SemST",0
Legalization of Abortion,"@CoraSherlock @NORTHANNE @fdelond you Cora ignore that IRE export the 'problem',to UK @MarieStopes #itwontgoaway #repealthe8th #SemST",2
Legalization of Abortion,Bernadette Smyth is an ignorant thunder cunt.  Not her life. Not her body. Not her business.  #ItsABallOfCellsNotABaby  #NewsNI #SemST,1
Legalization of Abortion,It is a poverty to decided that a child must die so that you may live as you wish. -Mother Teresa #SemST,0
Legalization of Abortion,#Liberals don't realize they conceded the debate. Now - per Shaw - we are just going to haggle over price.   #Idiots #SemST,2
Legalization of Abortion,"#SignsYoureInTheUSA Doc can pull baby 3/4 way out of the womb, stick a knife in its head 2 kill the child & @SCOTUS says its OK #SemST",0
Legalization of Abortion,#SCOTUS blocking part of our Texas Anti-Abortion law.  Maybe we should call them the Supreme Tyrant.  #tcot #tgdn #SemST,0
Legalization of Abortion,SCOTUS at it again!  Blocks Texas from enforcing part of new abortion law!  We have to stop killing babies! #SemST,0
Legalization of Abortion,Abortion laws should be designed to make it harder to get an abortion. Abortion is murder! #SemST,0
Legalization of Abortion,"#SupremeCourt  is on a roll this week, did they just discover #coffee or something?? #MarriageEquaility #SemST",2
Legalization of Abortion,"@SCOTUSblog My @TheGoodGodAbove, is it 1973 already? #SemST",2
Legalization of Abortion,Well that's a win for women in Texas. Thank you SCOTUS! #texas #SemST,1
Legalization of Abortion,Adding to the progress of this week the Supreme Court is also allowing Texas abortion clinics to stay open! #SCOTUS #SemST,1
Legalization of Abortion,It's time to end the #deathpenalty in the United States. #wholelife #SemST,0
Legalization of Abortion,abortion clinics... back alleys with a profit center and air conditioning?  #SemST,0
Legalization of Abortion,Our spirits Live on - thru the FAMILY BLOODLINE  - ONCE YOUR Bloodline is Destroyed  - U WILL NEVER REINCARNATE AGAIN   #LGBT #SemST,2
Legalization of Abortion,Definitely the #SCOTUS today has landed where women are. #Texas #clinics #issues #SemST,1
Legalization of Abortion,Progress for #AfricanAmericans check. Progress for #Gay people check. Progress for #Women. Waiting waiting waiting.... #SemST,1
Legalization of Abortion,Happy to hear the #SCOTUS blocked closing of 10 abortion clinics in TX until an appeal can be heard #safelegalrare #thinkprogress #SemST,1
Legalization of Abortion,"@enilk1988: @Chris_1791 @Doodisgirl   thought it was just tissue"" #SemST",0
Legalization of Abortion,"Sweat, killed and cut up his victim, extreme deadbeat parents do the same to innocent babies by abortion, #scotusabortion #SemST",0
Legalization of Abortion,"If the fetus isn't inside you, than shut up love #SemST",1
Legalization of Abortion,"@jacelarson He's not concerned about women's health, it's all about control. Stay outta my lady parts, Mr. Patrick! #SemST",1
Legalization of Abortion,"How can you be ""against abortion"" and also want to take away all the free birth control clinics for the poor? How? #SemST",1
Legalization of Abortion,The Supreme Court justices are on fire this week #LoveWins #SemST,2
Legalization of Abortion,@davebachman34 @Clifford1462 @msnbc you know what massively reduces abortion? Sex education and access to birth control. #SemST,1
Legalization of Abortion,Just because it is legal doesn't make it God honoring #SameSexMarriage #180themovie #AudacityMovie #SemST,2
Legalization of Abortion,"Roberts, Scalia, Alito, Thomas.  Hereinafter, "" R-SCAT "". #SCOTUS #Equality #SemST",2
Legalization of Abortion,#BlackLivesMatter Protesters wd'rather spray paint #Confederate symbols than concern themselves w/ Millions of Black Lives Lost to #SemST,2
Legalization of Abortion,Coming from a female that was taken away the ability to have children. I still believe women should have the ability to choose. #SemST,1
Legalization of Abortion,"@StAlbertCIVC do you have influence on policy on how the info is presented as a whole, given that you are listed as a Partner. #SemST",2
Legalization of Abortion,@SenatorLankford just a reminder that you are awful in every way and do not represent me. #prolove #proeducation #prohealthcare #SemST,2
Legalization of Abortion,At the Mass. State House again tomorrow for Planned Parenthood's Sexual Health Lobby Day #ReproductiveJustice #Feminism #SemST,1
Legalization of Abortion,EVERYONE has a right and choice of either HEAVEN or HELL. #ProMarriage #ProFaith #EternalLifeMatters #SemST,0
Legalization of Abortion,A woman who deliberately destroys a fetus is answerable for murder.-St. Basil the Great #SemST,0
Legalization of Abortion,". . . abortion is not self-defense, shooting the rapist is Kittington #PJNET #TCOT #SemST",0
Legalization of Abortion,Americans clearly support family planning. Cutting Title X is wrong #ProtectPrevention #savetitleX #SemST,1
Legalization of Abortion,#DonRients: people aren't just killed by guns.  9 people died and that's sad.  But how many die daily from #abortion? #SemST,0
Legalization of Abortion,@MarthaPlimpton It's not Monday on Twitter until some right wing troll sends me a video of an abortion #ReproRights #SemST,1
Legalization of Abortion,ALSO what the fuck gives a man the right to tell a woman what to do with her body? If she wants to get an abortion so be it Texas. #SemST,1
Legalization of Abortion,@OnlineForLife thank you for the way you beautifully communicate the pro-life message. You all consistently blow me away. #SemST,0
Legalization of Abortion,@__HisKindaCrazy @_QueenTacoBell @thumperbunny88 Abortion is NOT illegal and I would never judge a woman for making that choice. #SemST,1
Legalization of Abortion,"During an abortion, something alive must become dead to be considered a successful abortion...  #p2 #tcot #ChooseLife #Choice #SemST",0
Legalization of Abortion,@Anti_Fox_News @MannyMooncup @lexinelli @MattSears4 @FactsVsOpinion Hypocrisy: saying #LoveWins while supporting #QuitKillingGirls #SemST,2
Legalization of Abortion,The Constitution of Kenya 2010 is clear that abortion on demand is illegal.  #FIDA #SemST,0
Legalization of Abortion,"What a great 7 days to be an American, especially a Texan. #SCOTUS  #LoveWins #Obamacare  #SemST",1
