target,text,stance
Legalization of Abortion,Just laid down the law on abortion in my bioethics class. #Catholic #SemST,0
Legalization of Abortion,@tooprettyclub Are you OK with #GOP males telling you what you can and can't do with your own body? #SemST,1
Legalization of Abortion,"If you don't want your kid, put it up for adoption. #sorrynotsorry #SemST",0
Legalization of Abortion,"@RedAlert -there should be a ""stigma"" to butchering pre-born children - its a horrendous crime against humanity.  #murder #SemST",0
Legalization of Abortion,But isn't that the problem then. Not enough faith. #gaystapo #socialism #SemST,2
Legalization of Abortion,Life is our first and most basic human right. #SemST,0
Legalization of Abortion,Rise & Shine its a new day & you're alive. Thank God 4 another day of precious life. #Christian #Catholic #TeamJesus #SemST,0
Legalization of Abortion,Lmao my school thinks giving women the right to an abortion is against feminism. They don't know feminism #wtf #SemST,1
Legalization of Abortion,@AsaSoltan putting abortion in with choices for women just won my heart over. Yaaaaaas! #shahs #SemST,1
Legalization of Abortion,Last meeting of the year tonight! 7:00 pm in Case Hall room 334A. Come one come all! Pizza and pop will be provided! #SemST,2
Legalization of Abortion,"FACT: 17% of today's population is equivalent to residents in New York, Florida, and Pennsylvania.  Where's the outrage for this?  #SemST",2
Legalization of Abortion,They say God isn't listening? Just look at that radar today. #prayfornepal #SemST,2
Legalization of Abortion,If you believe in its power; then pray. #Nepal #Baltimore #ISIS #Kenya #GenderChange #Injustice #Slavery #Racism #MiddleEast #SemST,2
Legalization of Abortion,Planned Parenthood lines its pockets while sacrificing women and children in need at the altar of abortion. #SemST,0
Legalization of Abortion,It is not progressive to try to resolve problems by eliminating a human life. - #PopeFrancis #SemST,0
Legalization of Abortion,"RT @TheKeyisPrayer: ""No law can give me the right to do what is wrong.""  -Abraham Lincoln #SemST",0
Legalization of Abortion,We live in a world where people care more about religious rights than consent & reproductive rights.... #SemST,1
Legalization of Abortion,we remind ourselves that love means to be willing to give until it hurts - Mother Teresa #SemST,0
Legalization of Abortion,"Life, what a beautiful choice. Adoption. Not abortion. #SemST",0
Legalization of Abortion,My teacher today basically said that embroyo's are nothing but skin + blood & that abortion was fine. #smartlady #SemST,1
Legalization of Abortion,"@ShowTruth Keeping pregnant people safe is a great reason for abortion, though. #SemST",1
Legalization of Abortion,@rosaryrevival When we #PrayTheRosary lest we forget to #Prayforpersecutedchurch #PrayForIsrael #PrayForUkraine #SemST,2
Legalization of Abortion,#cogar @RefCom_ie get more #questions on #d #ballott! #ireland's #dail is stuck. We'll #help! #drugswar #landwar #etc. #tanks #SemST,2
Legalization of Abortion,"Yep. RT: ""Defunding PP won't mean fewer abortions. It will mean more dead women. #prochoice"" #1in3 #SemST",1
Legalization of Abortion,"@mrprolife You would force a woman to risk her health, sanity, and life, to continue a doomed pregnancy. Against her will. No. #SemST",1
Legalization of Abortion,Whether someone wants to have children or not should be completely up to the person carrying that pregnancy... #SemST,1
Legalization of Abortion,I will agree to gay marriage if you agree to pro-life and then adopt babies that would have been aborted. #SemST,0
Legalization of Abortion,"On Manila TV,Monday: #Pacquiao appeals to @IndonesiaPresident -don't execute #MaryJaneVeloso #deathRow #drugTrafficking #Christian #SemST",2
Legalization of Abortion,Too far? Sorry so is he #SemST,2
Legalization of Abortion,I watched #AfterTiller and it gave me a whole new perspective on a woman's right to choose. #womensRights #SemST,1
Legalization of Abortion,@explicit0ceans I don't either. Why would you want to make people have kids? Esp when they're not prepared? Makes no sense. #SemST,1
Legalization of Abortion,True progressives work toward greater inclusion and protections for the marginalized. Standing up for the unborn is progressive! #SemST,0
Legalization of Abortion,MT @ProLifePolitics- Senate vote on SC Pain-Capable Unborn Child Protection Act could come as early as Wed. Contact your senators! #SemST,0
Legalization of Abortion,Equal pay for equal work? YES. Freedom from the fear of rape and sexual objectification? YES. The 'right' to abort? NO. #SemST,0
Legalization of Abortion,"@explicit0ceans whoa whoa whoa. I don't care about you having sex, but when you're pregnant, there's another life involved. #SemST",0
Legalization of Abortion,Today I am grateful to have the right to control my body without govt influence. #antichoice leaders want to stop this. #abvote #SemST,1
Legalization of Abortion,"Sadly, most health insurance plans don't cover abortions, so the price can be quite high.... #SemST",1
Legalization of Abortion,@Britt_Ghiroli @mboyle1 But the Mayor of Baltimore said to give rioters to rioters. #BlackLivesMatter #Except2Democrats #Sanger #SemST,2
Legalization of Abortion,It is so much fun having younger friends who are expecting babies. #beentheredonethat #chooselife #SemST,0
Legalization of Abortion,Why is it illegal to kill an unhatched eagle egg but its legal to kill an unborn human baby?isright #SemST,0
Legalization of Abortion,I refuse to let people like you shame and insult women for accessing healthcare. Sorry. Just no.  #SemST,1
Legalization of Abortion,pro-life? no you're more pro-birth then after that the baby can support itself!!! #makesnosense #prowomen #SemST,1
Legalization of Abortion,U know what isn't funny? Male politicians deciding what women should do with their body's. #SemST,1
Legalization of Abortion,"I was born 4 months premature... I'm perfectly fine, somehow killing babies is legal in this country. #SemST",0
Legalization of Abortion,You can't kill someone cause you claim you made a mistake. If true nobody would go to jail for killing their spouse. #SemST,0
Legalization of Abortion,"@Corey_Frizzell @PEILiberalParty and most Islanders have different definitions of ""timely access"". #irony #peipoli #peivotes #SemST",2
Legalization of Abortion,@Docjp Pressure? It's their job and they are failing miserably at keeping the promises they made.  #GOP #PJNET #Amnesty #Obamacare #SemST,2
Legalization of Abortion,I love how #liberals only accuse #conservatives of war on women when we don't want to fund #SemST,0
Legalization of Abortion,Help your friend figure out how they're going to get there and where to stay if they need to spend the night #SemST,2
Legalization of Abortion,@JimDDaniels1 Plenty of reasons for Christians not to support Hillary. Not the least of which in my mind is her stand (w/Dems) on #SemST,0
Legalization of Abortion,I really don't understand how some people are Pro-Choice. A life is a life no matter if it's 2 weeks old or 20 years old. #SemST,0
Legalization of Abortion,Let's agree that it's not ok to kill a 7lbs baby in the uterus @DWStweets #DNC #Clinton2016 @HillaryforIA #ProCompromise #SemST,0
Legalization of Abortion,"@glennbeck I would like to see poll: How many abortion doctors have told a woman ""No, an abortion is not required in your case. #SemST",0
Legalization of Abortion,"Democrats are always AGAINST ""Personhood"" or what they perceive to be legislation to recognize #Personhood. Always. #Colorado #SemST",0
Legalization of Abortion,"@CultureShifting ""If you don't draw the line where I've arbitrarily drawn it, you can't draw it anywhere."" Nonsense. #SemST",2
Legalization of Abortion,"@k_yoder That lady needs help, mental illness is a serious issue. #SemST",2
Legalization of Abortion,"RT @createdequalorg: NEW video: ""I'm not seeing it as a human being."" @StandTrue @liveaction_news @collegefix @LifeSite #prolife... #SemST",0
Legalization of Abortion,"RT @createdequalorg: ""We're all human, aren't we? Every human life is worth the same, and worth saving."" -J.K. Rowling #... #SemST",0
Legalization of Abortion,Someone snitched on the mom having sex with and playing naked twister with teens. I bet it was her Cock blocking ass children. #SemST,2
Legalization of Abortion,"#SB724 passes Sen. Judiciary Cmte.This bill is an effort to shame women out of their personal, private medical decision to have an #SemST",1
Legalization of Abortion,RT @GrumpyOldGuy2: #DebbieWashermanSchultz the woman has a voice the doctor has a voice. Who speaks for the baby? I'm just askin. #SemST,0
Legalization of Abortion,"A needed, safe medical procedure is available to women. Unfortunately, RW men say they should make women's decisions. Sad, huh? #SemST",1
Legalization of Abortion,"RT @ProLifeYouth: ""It seems to me clear as daylight that abortion would be a crime."" -Ghandi  #ProLifeYouth #SemST",0
Legalization of Abortion,@LilaGraceRose defunding PP won't mean fewer abortions. It will mean more dead women. #SemST,1
Legalization of Abortion,"Govt cannot force you to get chemo but if you're a fetus, you must live! #JulieBorowski #reproductiverights #SemST",1
Legalization of Abortion,"A person's a person, no matter how small. - Dr. Suess #WAAR #SemST",0
Legalization of Abortion,As long as they are allowed to show medically correct photos of contraception use at the family planning table #StopAbortion #SemST,0
Legalization of Abortion,"Thanks for gently spoken truth,  @DanaPerino ! How DO we as a nation ""protect the innocent""? #TheFive #CCOT #DNC #RNC #SemST",0
Legalization of Abortion,@LuM1996 @KurtSchlichter #Obama cares more about deserters than unborn babies #ProtectTheUnprotected #AntiAbortion #SemST,0
Legalization of Abortion,"Dear Nuns, your advocacy of tax paying is weird. #war #Iraq #deathpenalty #taxespayforthistoo #TaxpayerPride #SemST",2
Legalization of Abortion,I've noticed that everybody that is for Abortion has already been born-Ronald Reagan #LetthemLive #AllLivesMatter #SemST,0
Legalization of Abortion,Follow #Patriot --> @Enuffis2Much.  Thanks for following back!!  #Truth #Liberty #Justice #ProIsrael #WakeUpAmerica #FreeAmirNow #SemST,2
Legalization of Abortion,".@DRUDGE_REPORT not sure I agree with her decision but, it is her decision.I wonder how many of the critics would support abortion? #SemST",1
Legalization of Abortion,Patient advocate Stephen Casey of Texas Center for Defense of Life strongly supports #HB3074. #TXlege #SemST,0
Legalization of Abortion,Are the same people who are red faced and frothing over abortion also against the death penalty? Just wondering... #deathpenalty #SemST,1
Legalization of Abortion,Hey Megan--a baby's heart starts beating at 21 days after conception. No time is the right time to end its life!! #kellyfile #SemST,0
Legalization of Abortion,@AzzarelliJim Not so great for the women you want to force to give birth against their wills. #rapeculture #SemST,1
Legalization of Abortion,What a great day to argue the benefits of making abortion legal #SemST,1
Legalization of Abortion,If my body is the only way you can live and I don't want that I have the right to dismiss you. I don't know why that's a problem #SemST,1
Legalization of Abortion,People who want kids can b prochoice. U don't have to want an abortion to b prochoice. People who had a miscarriage can b prochoice #SemST,1
Legalization of Abortion,@HillaryClinton Don't you mean to say (all children deserve the same chances) except the UNBORN CHILDREN?     #SemST,0
Legalization of Abortion,You know what's best for you You know what's best for your happiness You know what's best for your well being #SemST,1
Legalization of Abortion,@RyanDeloosh only if u want me to smash ur head through a solid wall made of steel each time u say it then shore honay #urchoice #SemST,2
Legalization of Abortion,Assaulting & manipulating pregnant people doesn't reduce #SemST,1
Legalization of Abortion,People who have never had an abortion can be prochoice. People with a uterus can be prochoice. People who never want kids can be #SemST,1
Legalization of Abortion,@jemimakirke my hat is off to you for speaking out about something that is rarely discussed by anyone who has a voice. #SemST,2
Legalization of Abortion,"Anti-vaxxers are such an idiotic bunch... Seriously, guys. Vaccinate. Your. Kids. #stopsb277 #conformcomics #marvel #dc #SemST",2
Legalization of Abortion,They may need to figure out how to get out of school or work that day. #SemST,2
Legalization of Abortion,God forbid you'd ever have to walk a mile in her shoes. Then you really might know what it's like to have to choose. #SemST,1
Legalization of Abortion,"I know what's best, for my health. You don't know anything about me.  #SemST",1
Legalization of Abortion,"Some people are not ready for a child or they were even raped, and theres already too many kids who need adopting anyway #SemST",1
Legalization of Abortion,"RT @pari_passu: Dear Religious Right: I keep my uterus out of your church, so keep your church out my uterus. #SemST",1
Legalization of Abortion,"@TheFullBug Dehumanizing? Why are you dehumanizing the pregnant person? They're more than walking incubators, and have rights! #SemST",1
Legalization of Abortion,The Democrats just gave the most chilling reply when asked if they support aborting 7-pound babies #SemST,0
Legalization of Abortion,Up at this ridiculous hour to #protectthezone.  #Alabama #SemST,2
Legalization of Abortion,"Tip for protesters everywhere: your goal is to change the minds of rational adults, not to scar the minds of little kids. #PGH #SemST",2
Legalization of Abortion,"Good morning Patriots, let us continue to Pray for this great Nation and the #UnBorn on this great day God has given us!! #ccot #SemST",0
Legalization of Abortion,Children are the greatest blessing which God has bestowed on man and woman. -Pope Francis #LifeisaGift #SemST,0
Legalization of Abortion,It is the greatest of all mistakes to do nothing because you can only do little. Do what you can. | #humandignity #SemST,2
Legalization of Abortion,Good morning @JustinTrudeau. Do you plan to tell @WadePEILiberal that women on PEI deserve the right to choose? #cdnpoli #peipoli #SemST,1
Legalization of Abortion,Excellent 'speed-dating' #ethics discussion today in Yr9 class #morality #SemST,2
Legalization of Abortion,UB Students for Life and @createdequalorg are currently on North Campus by the Student Union speaking out against #SemST,0
Legalization of Abortion,@sinnfeinireland  SinnFein voted to kill unborn sick children #SemST,0
Legalization of Abortion,"@JustinTrudeau, how do you plan 2 endorse @PEILiberalParty @WadePEILiberal who'd not b able 2 run 4 fed @liberal_party? #peipoli #SemST",2
Legalization of Abortion,They were slaying their own souls when they offered up their sons & when they shed the blood of infants. #Augustine #Psalm106 #SemST,0
Legalization of Abortion,BRAVO TO BOTH OF YOU BEAUTIFULLY EXPLAINED HOLD UP #humantrafficking bill @SenBlumenthal @DickDurbin #womensrights #righttochoose #SemST,1
Legalization of Abortion,It's a free country. Freedom includes freedom of choice. #SemST,1
Legalization of Abortion,"Unthinkable, shameful, acceptable, encouraged, desirable  ...the evolution of killing the defenseless.   @msnbc @jemimakirke #SemST",0
Legalization of Abortion,Thank you for another day of life Lord. #Christian #Catholic #TeamJesus #SemST,0
Legalization of Abortion,@AdamMyerson @quarq - Sent mine two days ago.  Expect it back in two days. Quick turnaround and great customer service! #SemST,2
Legalization of Abortion,Both Democrats and #IslamicState murder by dismemberment. The only difference is the age of their victims. #ISIS #SemST,0
Legalization of Abortion,@DWStweets @RepDWStweets is a seven pound baby murderer. Too bad her Mom didn't have the same operation. #Baby #Democrats #Losers #SemST,0
Legalization of Abortion,WH: Motherhood's a Wage Penalty. So we pay em to have kids & we pay em to kill premature babies. WTF's point here libs? #PJNET #SemST,0
Legalization of Abortion,"Hillary wants to be a champion for women, unless they're unborn.  #SemST",0
Legalization of Abortion,@BuckSexton of course we want the Feds to puff puff pass! #TeamBuck #warondrugs #SemST,2
Legalization of Abortion,like i really need to walk past a bunch of aborted babies to get into the union. get out of my peripheral #SemST,0
Legalization of Abortion,Follow #Patriot --> @MsMistiNichole.  Thanks for following back!!  #Truth #Liberty #Justice #ProIsrael #WakeUpAmerica #FreeAmirNow #SemST,2
Legalization of Abortion,I think Marcus is slightly scared of my radical liberal side #feministally #SemST,2
Legalization of Abortion,One day I'm gonna set an abortion clinic on fire. Anyone wanna join? #SemST,0
Legalization of Abortion,So ready for my abortion debate  #SemST,2
Legalization of Abortion,We have the duty to protect the life of an unborn child. --Ronald Reagan #ccot #gop #SemST,0
Legalization of Abortion,Some Bitches be scared to kill a little cockroach in their house but quick to kill a baby... #SemST,0
Legalization of Abortion,it's ironic that ppl will perform lifesaving therapies on animals to preserve their lives-but have staunch views in favor of #SemST,0
Legalization of Abortion,@tonylee01979 make their own decisions doesn't mean you need to harass me . Goodbye now. #freedom #SemST,2
Legalization of Abortion,"Is there a gas that increases self-mutilation (tattoos, piercing, drugging, over-eating, & suicide) & violence? #waleg #SemST",2
Legalization of Abortion,"Took God, discipline & tobacco out, made ^airtight & filled homes w/^CO2 cuz of energy & climate lies. Evil & energy use soared. #SemST",2
Legalization of Abortion,"deep-seated cultural codes, religious beliefs and structural biases have to be changed No, @HillaryClinton now what? #SemST",2
Legalization of Abortion,"PlannedParentHood, their agenda is all about the money. Killing babies is big business & minority genocide is the result. #ccot #SemST",0
Legalization of Abortion,RT @NYS4Life: RT if you're ready to help us defeat #AssistedSuicidelike we defeated #AbortionExpansion! #noPASny #SemST,0
Legalization of Abortion,@Loriisright @DWMcAliley1791 @LitaZahn Yup. One of the MANY reasons I changed parties. #SemST,2
Legalization of Abortion,"Oh look!!! So not only are antichoice strongly against pregnant people's human rights, they're also homophobic. Shocker. (Not) #SemST",1
Legalization of Abortion,"And do not kill ur children for fear of poverty. We provide for them & for u. Indeed, their killing is ever a great sin. #Quran #SemST",0
Legalization of Abortion,Still waiting for Libs to explain how the premeditated murder of a premature baby is reproductive healthcare. #ccot #SemST,0
Legalization of Abortion,@mrsdrjim did you know #wrp @BrianJeanWRP tried to get personhood going via federal #motion312. #SemST,2
Legalization of Abortion,How ironic is it that im sitting in @PPact & swiping on @Tinder right now? #SemST,2
Legalization of Abortion,"@explicit0ceans But adoption chooses to let them live. Obviously a huge difference. You can see that, right?  #Adoption #SemST",0
Legalization of Abortion,@BruvverEccles @Telegraph @David_Cameron I despair! I want grandchildren or are they a 'luxury item' #Catholic #SemST,0
Legalization of Abortion,"@Snitfit because it's not your baby, body or decision, nor does it effect your life in any way. So it's none of your business. #SemST",1
Legalization of Abortion,Obamcare loses again in the Supreme Court. Religious freedom win. #scotus #tcot #SemST,2
Legalization of Abortion,"The people who never spoke up against the Nazis during World War II were likely ""live and let live "" people. #fb #SemST",2
Legalization of Abortion,Pro-choice is pro-murder couched in liberal rhetoric. #SemST,0
Legalization of Abortion,Like ya'll can try and push your views on me anyway but I will remain #SemST,2
Legalization of Abortion,"@ProWomanChoice Exactly, no apologies needed to any #fundamentalist of any kind.  Stop apologies for rights. #p2 #SemST",1
Legalization of Abortion,"#Hillary, Here's one Christian whose religion views will never ""adapt"" to include abortion. Abortion is murder. #SemST",0
Legalization of Abortion,"Every time you respond to something that frustrates you, you let it steal away your time and happiness. #EasyWeightLoss #SemST",2
Legalization of Abortion,@NoMoreTeaForMe He said he would do it if he weren't a Christian. So he's also a coward.#RepKevinCalvey #p2 #LibCrib #UniteBlue #SemST,2
Legalization of Abortion,"wow all these people r so upset over 1 Black Man killed, what would they do if they knew about BlackKids killed by #BaltimoreRiots #SemST",2
Legalization of Abortion,"@ShowTruth No. It's absurd to refer to healthcare that saves pregnant people's lives as ""killing. #SemST",1
Legalization of Abortion,@GolfProYYC every time @TaylorMadeGolf pops up I think its you posting. #dyslexic #oneinthesame  #SemST,2
Legalization of Abortion,"@beckaviau @MikeRedmondNDP duh.... Planned pregnancy around election date, new fad. Get with the times. #SemST",2
Legalization of Abortion,Please join us as we pray to end the global holocaust of abortion! #SemST,0
Legalization of Abortion,"@ShowTruth No, I can't explain why you would consider a medical procedure that leaves the patient healthy & happy as killing. #SemST",1
Legalization of Abortion,@notmuchelse you want the freedom to murder a baby. Rip them limb by limb. No change in subject by me.Libertarian #SemST,0
Legalization of Abortion,@codeinediva Like i said you are weak. We are strong!   #Christian  #WeWillOvercome #SemST,0
Legalization of Abortion,@ProWomanChoice forcing women to change their body's normal function is the epitome of controlling women. #SemST,0
Legalization of Abortion,Like the govt. is literally taking away your right to live your own life by defunding right now #SemST,1
Legalization of Abortion,Watching teen mom and watching Farrah be a bitch makes me believe in abortion that much more. #SemST,1
Legalization of Abortion,"I'm killing my baby tonight, I don't care if it's wrong or right! #SemST",1
Legalization of Abortion,@AMLiveNTV:  its morally wrong. Life is sacred and only the giver and its onlyHim alone that should take it#HaveYourSay is on #SemST,0
Legalization of Abortion,@SteveStfler too many people are taking this to seriously #SemST,2
Legalization of Abortion,"She has a brain, a heart, and her own unique DNA, not her mother's. She is alive and human. Please don't kill her. #SemST",0
Legalization of Abortion,Agree choice if woman's life in danger.  But rape - does the baby deserve death for crime of his/her father? @HelpBillColeman #SemST,0
Legalization of Abortion,@LifeNewsHQ What could have happened in her past to make her the cruel & frighteningly hard-hearted woman she is? #waronwomen #SemST,2
Legalization of Abortion,Joining us in studio is Amos and Josh on Music and Career with Kobi Kihara #Bands #SemST,2
Legalization of Abortion,.@giannaberettamo @GiaMolla @sphcs_news Happy feast of St. Gianna Beretta Molla! May she pray for us! #SemST,0
Legalization of Abortion,What is the difference between a baby and a onion? No one cries when you chop up the baby.   Hahahahaha! Love dead babies! #Babies #SemST,1
Legalization of Abortion,How can a kingdom founded in violence long control the vice that brought it n2 existence? <-- commentary on Judges9 @BarackObama #SemST,2
Legalization of Abortion,Pro-Choice is meaningless. Say what you mean. You stand for the right to choose to kill. #SemST,0
Legalization of Abortion,Kudos to the mentality that believes people who are dumb enough to not use protection are 'mature enough' to take care of a baby. #SemST,1
Legalization of Abortion,Please pray for mercy for #AndrewChan & #MyuranSukumaran #IStandForMercy #KeepHopeAlive #Bali9 #SemST,2
Legalization of Abortion,I just want to sit in a corner and cry.  I wish I was a thicker-skinned feminist but this shit is personal! #MyBodyMyRights #SemST,1
Legalization of Abortion,@Fredindimuli  yes he has an opinion but the choice should be in the hands of the women You know the person directly affected? #SemST,1
Legalization of Abortion,Gov Brownback visits cities in #Kansas 2 sign new #bill  #woman #SemST,2
Legalization of Abortion,I refuse to stop praying for an end to abortion. #SemST,0
Legalization of Abortion,"@BBCNewshour ""if u had been my wife I would have blow your head off."" Yep, that sound like #ElSalvador #SemST",2
Legalization of Abortion,@smalldoctor15: What is postinor popularly used for? #SemST,2
Legalization of Abortion,So mint!  Listening to @GlennBeck LIVE & he s talking about #MargaretSanger being total Evil. Even if you're pro-#Abortion! #SemST,0
Legalization of Abortion,"@WayneSense ""In check"" is putting it nicely. #MargaretSanger #SemST",2
Legalization of Abortion,"@ProLifeLiberty Yes, your reasoning is horrible. We were talking about abortion, not death. #SemST",1
Legalization of Abortion,Terrible golf last couple days! Goes down on the notes as one of these  #SemST,2
Legalization of Abortion,Idiot: how would you feel if your mom aborted you?  Me: nothing cause I would be fucking dead. #SemST,0
Legalization of Abortion,"@LifeNewsHQ  22wks is too late to be able to have a termination in my opinion, these triplets are babies not a bunch of cells. #SemST",0
Legalization of Abortion,Dude i won a #freeshirt from @abort73 ! I never win anything lol #Abort73 #SemST,2
Legalization of Abortion,Praying for that innocent lady. She's a victim too. I hope the execution will not proceed. #NoToDeathPenalty #SaveMaryJaneVeloso #SemST,2
Legalization of Abortion,Findin budget compromise a 'process' #Brownback says  #income #thestate #SemST,2
Legalization of Abortion,@AnneJp1946 I have no problem with birth control but their you go with that free thing again. So your solution is murder good idea #SemST,0
